log_id,equipment_id,event_type,timestamp,operator_id,message
LOG0001422,WELDER-001,startup,2025-12-04T08:00:33.195Z,OP1,Aeternus utrimque attero volubilis tabgo apparatus celebrer vespillo ventosus.
LOG0001423,WELDER-001,alarm,2025-11-10T11:41:26.856Z,OP4,Sperno trepide virga curso.
LOG0001424,CNC-001,startup,2025-10-26T00:49:17.900Z,OP30,Caelestis strenuus derelinquo aegrus defero cura sui decor.
LOG0001425,FURNACE-001,maintenance,2025-10-02T11:14:44.185Z,OP3,Ancilla subvenio umerus conspergo vitium qui beatus ipsam.
LOG0001426,PRESS-001,alarm,2025-10-17T12:41:42.360Z,OP11,Utpote ratione adduco constans caste curto venustas theca.
LOG0001427,WELDER-001,production,2025-11-14T11:35:19.064Z,OP3,Chirographum supplanto accendo.
LOG0001428,FURNACE-001,production,2025-12-11T17:04:27.045Z,OP20,Succurro comminor tenax balbus clam dapifer.
LOG0001429,PRESS-001,alarm,2025-12-21T10:02:17.665Z,OP13,Sponte cras depromo patior suppono nam.
LOG0001430,CNC-002,alarm,2025-11-21T00:36:56.450Z,OP2,Antea annus crastinus adamo capitulus tantillus argentum candidus.
LOG0001431,WELDER-001,shutdown,2026-01-01T20:24:28.926Z,OP10,Damnatio vulnus deprecator.
LOG0001432,PRESS-002,maintenance,2025-10-14T02:03:28.917Z,OP2,Voro adhaero trucido creta assentator condico.
LOG0001433,FURNACE-001,production,2025-11-11T13:09:30.072Z,OP12,Abbas deserunt coruscus suppellex praesentium.
LOG0001434,PRESS-002,shutdown,2025-11-03T07:26:03.249Z,OP30,Carpo iste sustineo vero adipiscor depono pax.
LOG0001435,PRESS-002,production,2025-11-06T01:42:55.403Z,OP20,Desparatus benigne calamitas adversus vito.
LOG0001436,CNC-001,production,2025-10-27T18:39:04.717Z,OP25,Depono usus vacuus creator adiuvo thermae.
LOG0001437,FURNACE-001,maintenance,2025-10-24T21:31:25.224Z,OP2,Culpo complectus soleo supra amissio dedecor veritatis corona tracto benigne.
LOG0001438,PRESS-001,shutdown,2026-01-25T20:44:27.172Z,OP8,Una carus terreo facere molestiae comparo neque nobis mollitia creator.
LOG0001439,FURNACE-001,startup,2025-10-02T16:54:23.446Z,OP30,Concido cohaero esse accommodo debeo abbas depraedor.
LOG0001440,PRESS-002,production,2025-10-20T04:37:14.081Z,OP18,Speculum audentia voluptate comedo animadverto cimentarius abeo.
LOG0001441,FURNACE-001,shutdown,2026-01-21T09:30:13.650Z,OP23,Vicinus advenio coepi aspernatur aer.
LOG0001442,FURNACE-001,alarm,2025-10-24T19:55:27.406Z,OP18,Decimus voluptatibus testimonium rerum carmen.
LOG0001443,CNC-002,production,2026-01-15T11:09:07.938Z,OP18,Aufero quo minus.
LOG0001444,PRESS-002,startup,2025-10-06T15:41:36.306Z,OP27,Decor pauper cultellus asporto audeo impedit sto teneo calco amor.
LOG0001445,FURNACE-001,maintenance,2026-01-04T11:00:44.389Z,OP11,Nostrum corroboro conculco depopulo defero bis.
LOG0001446,FURNACE-001,startup,2026-01-07T21:26:11.949Z,OP15,Cavus vae delectatio magni decimus templum.
LOG0001447,PRESS-001,production,2025-12-21T19:14:46.586Z,OP15,Aiunt patria crebro aptus amiculum cenaculum calco.
LOG0001448,CNC-001,maintenance,2026-01-14T15:07:19.670Z,OP21,Sono brevis dolor adimpleo comptus claudeo vaco.
LOG0001449,PRESS-002,shutdown,2025-12-17T18:11:47.904Z,OP13,Charisma culpo deficio solium benevolentia.
LOG0001450,PRESS-002,maintenance,2025-11-12T02:32:12.442Z,OP5,Virtus vesper vitiosus templum pax amplexus magnam alveus confero.
LOG0001451,CNC-002,alarm,2025-12-25T16:09:38.843Z,OP23,Adhaero addo eveniet culpo aliquam venustas coma tardus suus.
LOG0001452,CNC-001,shutdown,2025-12-22T22:12:42.875Z,OP27,Vesica blandior aurum vis coruscus.
LOG0001453,FURNACE-001,shutdown,2025-10-05T04:38:17.564Z,OP9,Coerceo cena harum cilicium vigilo nemo.
LOG0001454,PRESS-001,alarm,2025-11-19T22:39:03.122Z,OP7,Repellendus advenio crinis.
LOG0001455,PRESS-001,maintenance,2025-11-01T16:53:22.716Z,OP13,Arcesso solio una utroque trepide sed aduro paulatim thermae.
LOG0001456,WELDER-001,production,2025-12-26T22:36:37.144Z,OP11,Audio tendo tergiversatio acer alius suus vinculum volup eos cras.
LOG0001457,CNC-001,alarm,2026-01-01T16:51:56.907Z,OP12,Aduro alveus rem ter compello sortitus ara.
LOG0001458,WELDER-001,alarm,2025-12-05T02:53:57.539Z,OP6,Vinum ulterius ea cuppedia.
LOG0001459,PRESS-001,shutdown,2025-10-05T23:50:33.163Z,OP24,Crux stillicidium denuncio subito pecus vigor coadunatio animus.
LOG0001460,FURNACE-001,production,2026-01-25T15:39:00.216Z,OP23,Ulterius degenero depono tamquam voluntarius video stipes.
LOG0001461,WELDER-001,production,2025-11-20T20:05:37.515Z,OP29,Praesentium tantillus adficio tot.
LOG0001462,WELDER-001,shutdown,2026-01-30T17:54:06.955Z,OP9,Astrum thema volubilis comprehendo ventus ratione.
LOG0001463,PRESS-001,production,2025-11-14T18:04:27.281Z,OP5,Peior credo despecto adamo utpote.
LOG0001464,PRESS-002,shutdown,2026-02-05T13:59:17.112Z,OP22,Balbus acsi curtus complectus abscido consuasor appono caute.
LOG0001465,PRESS-002,shutdown,2025-11-19T18:34:29.724Z,OP19,Atavus cibo abduco abeo adversus.
LOG0001466,CNC-001,shutdown,2026-02-10T09:54:39.752Z,OP1,Sodalitas thesaurus reprehenderit.
LOG0001467,FURNACE-001,startup,2025-11-21T21:21:44.428Z,OP7,Abeo tabesco demens derelinquo tremo villa dapifer.
LOG0001468,PRESS-001,production,2025-11-14T20:03:39.696Z,OP28,Ago adnuo angelus solitudo minima pel aestas coaegresco valetudo combibo.
LOG0001469,CNC-002,production,2025-10-17T03:34:38.333Z,OP23,Adeo canto cernuus custodia.
LOG0001470,PRESS-001,maintenance,2026-01-21T14:38:43.430Z,OP15,Virga quos cerno.
LOG0001471,PRESS-002,alarm,2025-10-18T03:37:15.004Z,OP30,Textilis suggero crastinus deputo deorsum.
LOG0001472,PRESS-002,shutdown,2025-11-08T02:54:40.658Z,OP3,Thema substantia maxime vigor tremo velut ancilla.
LOG0001473,PRESS-002,alarm,2025-12-29T10:50:42.644Z,OP1,Commemoro conspergo vomer.
LOG0001474,FURNACE-001,maintenance,2025-11-21T20:32:10.926Z,OP5,Statua thermae suffoco dapifer deficio.
LOG0001475,FURNACE-001,alarm,2026-01-08T11:18:29.742Z,OP26,Aro vehemens esse tener cupressus volo supra modi cogo corrumpo.
LOG0001476,WELDER-001,maintenance,2026-01-03T21:30:58.230Z,OP21,Censura beatus ascit praesentium tumultus pel accendo cruciamentum audax.
LOG0001477,CNC-001,alarm,2026-02-09T19:39:33.356Z,OP5,Commodo adfectus sodalitas quod animi.
LOG0001478,FURNACE-001,alarm,2025-11-29T19:32:11.226Z,OP17,Conor defendo tametsi tamdiu arbustum minima ater auctor deporto facere.
LOG0001479,WELDER-001,production,2026-02-07T20:54:23.132Z,OP15,Apto tertius calcar.
LOG0001480,CNC-001,alarm,2025-10-26T19:59:34.879Z,OP9,Sum sursum causa vinco usus cunctatio.
LOG0001481,WELDER-001,alarm,2026-01-06T13:52:39.964Z,OP15,Bibo exercitationem supellex atavus cariosus.
LOG0001482,CNC-001,maintenance,2026-01-01T10:00:13.487Z,OP29,Cognomen verecundia at ventus veritas tracto antiquus derelinquo.
LOG0001483,WELDER-001,maintenance,2025-12-16T20:25:14.942Z,OP26,Debilito ancilla creptio amicitia cauda cuius quam conturbo.
LOG0001484,PRESS-001,production,2025-11-18T14:55:43.107Z,OP26,Utique vaco veritatis.
LOG0001485,PRESS-001,maintenance,2026-01-25T15:30:04.564Z,OP28,Voluptatum admitto exercitationem unus teneo suscipit.
LOG0001486,CNC-002,shutdown,2025-11-03T04:20:45.982Z,OP13,Vesco defero denuncio dicta cedo arbitro carcer aggredior.
LOG0001487,PRESS-002,production,2025-11-16T17:18:06.553Z,OP19,Depopulo cultellus degero amplus angelus uredo delicate catena aequitas.
LOG0001488,PRESS-002,alarm,2025-12-10T19:53:49.254Z,OP1,Deprecator dicta bardus somniculosus.
LOG0001489,CNC-001,alarm,2025-10-28T07:05:42.326Z,OP29,Cunabula urbanus laudantium color umbra fugiat.
LOG0001490,FURNACE-001,production,2025-12-15T04:56:15.903Z,OP6,Adsuesco tristis repudiandae cohaero virga.
LOG0001491,PRESS-001,alarm,2025-11-07T11:23:42.951Z,OP16,Calculus laudantium cupiditas addo tondeo triumphus demens aegre.
LOG0001492,CNC-002,maintenance,2025-11-02T09:38:41.967Z,OP20,Sollicito aggero cognatus conicio aestus hic vinitor.
LOG0001493,PRESS-001,maintenance,2026-02-06T13:39:01.425Z,OP13,Victus amaritudo assumenda pauper.
LOG0001494,FURNACE-001,maintenance,2025-12-02T13:22:59.635Z,OP26,Demens artificiose quos vomer cariosus agnosco bardus.
LOG0001495,WELDER-001,maintenance,2026-02-05T12:58:09.841Z,OP6,Cubo aut cras suscipio atrox.
LOG0001496,CNC-001,production,2025-12-04T18:20:02.321Z,OP18,Valetudo aliquid stips contabesco ullam.
LOG0001497,WELDER-001,production,2025-11-18T14:28:50.731Z,OP27,Ventito capio pectus turpis culpo.
LOG0001498,CNC-001,alarm,2025-12-09T06:59:36.462Z,OP1,Thymbra crudelis deporto cubicularis ulciscor.
LOG0001499,CNC-001,alarm,2026-01-26T02:48:54.648Z,OP22,Arbor calcar arbustum bestia calculus verumtamen rem porro ea.
LOG0001500,FURNACE-001,maintenance,2026-02-03T13:12:45.693Z,OP19,Congregatio cubo varius usitas tergeo.
LOG0001501,CNC-001,shutdown,2025-10-07T02:54:32.775Z,OP25,Patior versus thalassinus avaritia totam vacuus vorax cur.
LOG0001502,PRESS-001,production,2026-01-13T18:01:01.668Z,OP25,Artificiose titulus deripio amita cariosus conitor cubitum vapulus adficio.
LOG0001503,CNC-002,shutdown,2025-10-15T08:48:06.411Z,OP15,Tristis subvenio admoveo vito.
LOG0001504,FURNACE-001,shutdown,2025-11-23T05:59:43.263Z,OP8,Sperno thesaurus absque id.
LOG0001505,CNC-002,alarm,2025-11-26T23:04:20.454Z,OP3,Vicissitudo eligendi consuasor depromo.
LOG0001506,PRESS-001,production,2026-01-17T15:00:58.289Z,OP28,Curo facere tenax atqui clarus timidus curis.
LOG0001507,WELDER-001,production,2026-02-13T10:02:56.379Z,OP24,Natus trucido distinctio varius creta confugo alveus consectetur statua beneficium.
LOG0001508,WELDER-001,production,2026-01-06T03:44:13.186Z,OP30,Comparo ea curis.
LOG0001509,WELDER-001,production,2025-12-16T12:46:36.794Z,OP13,Cupressus altus acidus.
LOG0001510,CNC-001,maintenance,2026-02-12T00:44:42.277Z,OP11,Absorbeo cunctatio aiunt adsidue patruus pax virga.
LOG0001511,FURNACE-001,startup,2025-10-20T21:21:36.544Z,OP20,Admitto ater cernuus.
LOG0001512,WELDER-001,alarm,2026-01-14T05:22:14.295Z,OP23,Soleo amissio quis decumbo terror statua.
LOG0001513,PRESS-002,maintenance,2026-02-03T12:32:29.050Z,OP13,Credo clarus solitudo arto voluptates suscipit cubitum tyrannus substantia.
LOG0001514,PRESS-002,maintenance,2025-10-07T14:29:01.137Z,OP8,Suasoria arcesso compono acer appello tracto vivo.
LOG0001515,PRESS-001,startup,2025-11-29T17:41:35.560Z,OP11,Velum calamitas sub vulgaris.
LOG0001516,CNC-001,startup,2025-11-09T07:18:47.871Z,OP7,Defetiscor capitulus accendo ullus sequi degenero deduco.
LOG0001517,WELDER-001,shutdown,2026-01-18T18:53:10.277Z,OP19,Stips trepide eius sollers campana unus timidus degenero.
LOG0001518,PRESS-001,startup,2026-01-13T07:32:03.162Z,OP27,Capto delectatio varietas cimentarius cuppedia aspicio umquam rem.
LOG0001519,PRESS-002,maintenance,2026-01-26T07:02:59.457Z,OP7,Aro coerceo capitulus ipsa viriliter ab acsi.
LOG0001520,PRESS-001,maintenance,2026-01-27T08:29:08.471Z,OP12,Cupressus error aspernatur.
LOG0001521,PRESS-002,startup,2025-12-25T16:54:31.349Z,OP15,Amoveo baiulus amita.
LOG0001522,CNC-002,shutdown,2026-01-10T16:37:29.275Z,OP7,Amoveo centum cohors carbo.
LOG0001523,PRESS-001,production,2025-10-17T14:37:49.884Z,OP18,Cultura rerum acer cavus tutamen.
LOG0001524,PRESS-001,alarm,2026-02-06T02:33:40.893Z,OP22,Vinum textor atqui vos blanditiis admoneo.
LOG0001525,CNC-001,shutdown,2026-01-29T09:37:07.644Z,OP18,Voluntarius quae canto bibo agnosco cras consuasor sonitus aeger tam.
LOG0001526,PRESS-002,production,2025-11-22T02:09:19.732Z,OP2,Vulgaris validus confero viscus tenetur adeptio trepide defluo.
LOG0001527,PRESS-002,alarm,2025-12-05T05:46:14.242Z,OP13,Vulariter audio deputo terra caute catena deludo.
LOG0001528,PRESS-001,maintenance,2026-01-30T15:21:15.922Z,OP10,Sopor communis vitae.
LOG0001529,FURNACE-001,maintenance,2025-10-03T06:02:28.880Z,OP2,Caries tersus stabilis textus tardus.
LOG0001530,WELDER-001,startup,2025-12-11T12:29:55.202Z,OP28,Aequus nesciunt termes curo eos voco provident repudiandae eaque terra.
LOG0001531,WELDER-001,alarm,2025-11-11T00:52:04.746Z,OP23,Carmen claustrum sonitus asper deficio amicitia avarus concedo.
LOG0001532,PRESS-002,alarm,2025-12-29T17:48:57.836Z,OP9,Argumentum versus depopulo cauda vacuus tepidus.
LOG0001533,CNC-002,production,2025-10-17T16:33:05.401Z,OP23,Solitudo agnitio asper tutamen sufficio arto officia votum.
LOG0001534,WELDER-001,maintenance,2025-11-27T04:57:48.277Z,OP21,Voluptatibus esse tepidus vitium armarium paulatim contego ars communis.
LOG0001535,PRESS-001,alarm,2025-10-13T22:28:50.928Z,OP10,Acidus vereor nemo ter sol antepono.
LOG0001536,FURNACE-001,startup,2026-02-06T12:20:34.098Z,OP5,Sol bis adstringo tergum uterque rerum maiores asporto deprimo.
LOG0001537,PRESS-002,production,2026-01-26T10:49:04.464Z,OP14,Benigne summopere brevis caute quasi.
LOG0001538,CNC-002,shutdown,2025-11-12T16:23:53.453Z,OP18,Degenero tergiversatio supplanto virtus.
LOG0001539,WELDER-001,shutdown,2025-10-24T01:08:02.860Z,OP24,Synagoga contigo substantia.
LOG0001540,WELDER-001,shutdown,2026-01-03T23:40:41.517Z,OP5,Triumphus adulatio theca.
LOG0001541,CNC-001,maintenance,2025-12-19T17:22:37.139Z,OP13,Virgo vita decerno.
LOG0001542,FURNACE-001,startup,2025-11-26T12:11:29.838Z,OP2,Veritas cohibeo sumptus tergum video voluptate vitae.
LOG0001543,CNC-002,production,2026-01-04T14:19:47.316Z,OP24,Amplitudo socius vado.
LOG0001544,PRESS-001,maintenance,2025-10-03T11:19:07.704Z,OP6,Saepe dedico conor adduco coniecto sapiente vestrum possimus eveniet.
LOG0001545,PRESS-002,startup,2025-11-16T23:03:45.122Z,OP16,Somnus votum tam benevolentia censura tempus adnuo modi confugo ver.
LOG0001546,CNC-002,alarm,2026-02-14T02:21:08.302Z,OP8,Allatus baiulus temporibus aperte cado amplus magnam tabella usitas.
LOG0001547,CNC-002,startup,2026-01-11T09:31:27.439Z,OP25,Virgo caritas trans dapifer cilicium.
LOG0001548,FURNACE-001,maintenance,2026-01-04T10:09:21.877Z,OP6,Aequus allatus amplus angustus adsum villa vespillo numquam casso absque.
LOG0001549,PRESS-002,production,2025-11-26T00:24:02.577Z,OP10,Conduco sulum pauper.
LOG0001550,WELDER-001,maintenance,2025-10-26T20:58:48.258Z,OP20,Tabella celo inventore.
LOG0001551,CNC-002,maintenance,2025-11-18T03:11:11.421Z,OP26,Demo timidus calamitas tactus stipes temeritas demergo desipio turpis.
LOG0001552,PRESS-002,maintenance,2026-01-07T20:00:19.921Z,OP1,Absens volubilis volup ventosus appello condico.
LOG0001553,CNC-001,shutdown,2025-12-25T04:50:40.222Z,OP21,Claudeo vox paulatim adicio textus comis.
LOG0001554,FURNACE-001,alarm,2025-10-12T15:34:38.671Z,OP19,Annus assentator natus dolorem sperno cornu vester.
LOG0001555,PRESS-002,alarm,2025-11-12T02:50:49.523Z,OP29,Thymbra velit ter tepesco color antea allatus verbera terror.
LOG0001556,CNC-001,maintenance,2026-02-01T07:12:03.582Z,OP16,Demulceo labore ullam cernuus adsuesco.
LOG0001557,CNC-002,maintenance,2025-12-27T06:24:09.343Z,OP19,Ratione virgo clibanus cariosus tenetur.
LOG0001558,PRESS-001,maintenance,2025-11-06T06:21:33.368Z,OP6,Cursus dens amo antea culpa.
LOG0001559,CNC-001,startup,2025-11-20T06:36:24.729Z,OP12,Templum debeo contigo cinis deputo soleo votum.
LOG0001560,WELDER-001,maintenance,2025-12-14T01:00:45.669Z,OP3,Eum voluptates asporto theologus doloremque adfectus demulceo.
LOG0001561,CNC-001,maintenance,2025-12-21T18:52:55.346Z,OP9,Suscipit corroboro comptus tendo magnam coerceo aeternus.
LOG0001562,CNC-002,startup,2025-11-27T17:47:33.077Z,OP2,Solium minima comparo vir pariatur crudelis taceo taedium.
LOG0001563,CNC-001,production,2025-10-26T21:41:41.808Z,OP27,Cura depono vulgo temperantia pectus addo.
LOG0001564,CNC-002,maintenance,2026-01-07T22:13:32.246Z,OP16,Debitis caput viduo somnus conatus tripudio deficio.
LOG0001565,CNC-002,alarm,2025-10-28T01:28:10.634Z,OP20,Thorax ullus sodalitas conduco sollicito adaugeo.
LOG0001566,WELDER-001,maintenance,2025-12-07T21:32:38.761Z,OP17,Curis agnitio voluptatem.
LOG0001567,PRESS-002,startup,2026-02-05T11:09:02.847Z,OP29,Ut perferendis audax cibus communis terebro tot volubilis.
LOG0001568,FURNACE-001,maintenance,2025-11-07T20:09:42.447Z,OP2,Truculenter quo celo decerno.
LOG0001569,CNC-001,shutdown,2026-02-12T23:59:58.253Z,OP10,Ad totus laboriosam contabesco animadverto templum bos maxime rem.
LOG0001570,PRESS-001,startup,2025-11-03T05:04:34.471Z,OP26,Appello vociferor suffragium.
LOG0001571,FURNACE-001,alarm,2025-12-11T07:18:52.418Z,OP7,Demergo amita tersus et calamitas thymum testimonium.
LOG0001572,PRESS-001,production,2026-01-01T19:56:18.013Z,OP14,Universe statim bellicus aer demitto comprehendo vel.
LOG0001573,FURNACE-001,shutdown,2025-10-21T02:57:11.954Z,OP15,Confido sonitus aqua.
LOG0001574,WELDER-001,shutdown,2025-11-21T05:14:36.210Z,OP20,Numquam assentator aequus tristis auditor theatrum.
LOG0001575,CNC-001,maintenance,2026-01-27T14:39:31.038Z,OP17,Deficio templum commemoro aut cunae ceno laboriosam.
LOG0001576,CNC-001,maintenance,2025-10-05T09:56:16.884Z,OP8,Umbra supra utroque fuga abstergo decerno vado trado barba reiciendis.
LOG0001577,FURNACE-001,shutdown,2025-11-14T21:58:33.777Z,OP10,Excepturi censura subseco occaecati umbra comitatus est amoveo aequus audax.
LOG0001578,WELDER-001,alarm,2026-01-13T07:08:49.492Z,OP7,Adsum suffoco vesper condico molestias coniecto basium subito a.
LOG0001579,CNC-001,startup,2025-12-10T22:27:02.510Z,OP23,Acerbitas statua eum cultellus.
LOG0001580,PRESS-001,alarm,2025-11-24T03:52:44.535Z,OP19,Usque calculus perferendis tres crux viriliter fuga tamquam.
LOG0001581,PRESS-002,alarm,2026-01-09T15:34:50.672Z,OP11,Casso non atqui.
LOG0001582,WELDER-001,alarm,2025-10-21T03:40:45.135Z,OP7,Consuasor supellex blanditiis suus.
LOG0001583,CNC-002,production,2025-11-05T18:34:09.960Z,OP17,Ventus ratione deripio tenax ascisco natus canto brevis abutor.
LOG0001584,WELDER-001,shutdown,2026-02-02T17:45:48.877Z,OP17,Perferendis asperiores apud deserunt demulceo.
LOG0001585,PRESS-001,alarm,2025-12-23T08:22:26.964Z,OP21,Beatae hic suadeo officiis nam valetudo.
LOG0001586,WELDER-001,alarm,2025-10-14T02:11:50.549Z,OP4,Delectatio umquam demonstro ullam desipio conspergo substantia defungo suscipio traho.
LOG0001587,WELDER-001,startup,2025-12-19T11:52:20.309Z,OP28,Aegrotatio ad angelus contabesco.
LOG0001588,PRESS-002,shutdown,2025-12-20T22:49:28.476Z,OP13,Agnitio cauda dapifer abutor attero canis socius thalassinus.
LOG0001589,CNC-002,shutdown,2025-11-10T08:11:47.549Z,OP14,Dedecor charisma curto patruus minus.
LOG0001590,PRESS-002,production,2025-10-25T03:24:57.039Z,OP6,Comis conservo repellendus.
LOG0001591,PRESS-001,production,2026-01-29T06:35:13.774Z,OP15,Tersus demum summisse adduco aliquam conservo ducimus succedo volup.
LOG0001592,CNC-002,startup,2025-12-04T13:23:11.708Z,OP14,Stips deficio nihil soluta esse ipsum animi cernuus doloremque depopulo.
LOG0001593,PRESS-001,maintenance,2025-12-10T16:25:30.374Z,OP28,A fuga solium.
LOG0001594,PRESS-001,production,2025-10-11T15:28:53.602Z,OP19,Esse adduco cubo truculenter curriculum vaco cur cetera ambulo terga.
LOG0001595,PRESS-001,maintenance,2025-10-15T20:53:27.242Z,OP13,Angelus vere cohaero facilis vitiosus quam universe altus esse.
LOG0001596,CNC-002,maintenance,2025-11-17T02:11:37.336Z,OP5,Succedo statua decretum substantia vigor ars vehemens autus impedit deleo.
LOG0001597,FURNACE-001,startup,2025-10-13T14:01:32.927Z,OP1,Sophismata tener cubicularis vicissitudo usus.
LOG0001598,FURNACE-001,production,2025-12-25T13:48:59.841Z,OP1,Abutor similique patrocinor enim cavus cunctatio abduco amoveo amaritudo canis.
LOG0001599,PRESS-001,startup,2025-12-24T05:34:19.571Z,OP23,Cognatus amplus volva.
LOG0001600,PRESS-001,startup,2025-10-29T07:34:20.459Z,OP14,Delectus asperiores iure comitatus aggredior denego canis.
LOG0001601,WELDER-001,shutdown,2026-02-04T16:54:06.364Z,OP17,Assentator ulterius thesis.
LOG0001602,PRESS-002,alarm,2025-10-08T19:36:27.864Z,OP13,Aer supellex verbera corrigo admiratio aeternus voluptates culpo defetiscor.
LOG0001603,CNC-002,shutdown,2025-10-05T21:32:41.426Z,OP22,Curtus solium theatrum harum tam consequatur celebrer arcesso totidem amicitia.
LOG0001604,PRESS-002,alarm,2025-10-13T08:29:53.062Z,OP11,Umbra tertius canis vinculum cursus solio textor.
LOG0001605,CNC-002,shutdown,2025-11-22T03:00:27.460Z,OP27,Talio adhuc acidus contego abeo.
LOG0001606,PRESS-002,alarm,2026-01-09T02:31:26.173Z,OP13,Est eveniet commodi inventore.
LOG0001607,CNC-002,startup,2026-02-14T09:24:57.611Z,OP7,Unde aureus aufero uxor bellicus in viriliter apto.
LOG0001608,FURNACE-001,alarm,2026-01-19T07:07:58.208Z,OP13,Tego cultellus cupiditas dolore spiculum conor.
LOG0001609,PRESS-002,startup,2025-11-26T22:26:10.703Z,OP22,Vapulus temperantia delibero odio uxor tepidus terror turbo temporibus dolore.
LOG0001610,FURNACE-001,alarm,2025-10-07T08:20:16.550Z,OP16,Templum acsi utilis ventito aureus depulso urbanus vesica.
LOG0001611,PRESS-001,maintenance,2026-01-10T22:02:02.014Z,OP12,Dapifer abscido depromo approbo solum arceo ut clam adduco amaritudo.
LOG0001612,PRESS-002,startup,2025-10-01T17:55:35.666Z,OP7,Attonbitus arca aveho eos bos non.
LOG0001613,PRESS-001,production,2025-12-26T01:44:34.412Z,OP1,Sol tego quos tollo cura allatus ciminatio surculus tondeo labore.
LOG0001614,CNC-001,alarm,2025-12-16T19:13:13.718Z,OP13,Attonbitus pel angelus absorbeo degusto soluta super confugo.
LOG0001615,PRESS-001,alarm,2026-01-10T07:46:27.349Z,OP9,Triduana defungo adversus vulpes ciminatio cur arca.
LOG0001616,CNC-001,maintenance,2025-10-28T12:11:00.847Z,OP22,Doloremque commodo umbra adstringo caelestis arbitro.
LOG0001617,CNC-001,maintenance,2025-12-14T03:52:55.222Z,OP12,Sunt chirographum benigne vel trepide cresco tolero.
LOG0001618,PRESS-001,production,2026-01-17T03:01:59.034Z,OP1,Carus tabernus capitulus vox taedium vigor.
LOG0001619,CNC-002,maintenance,2025-12-25T10:29:21.380Z,OP23,Umquam uterque vigilo asporto.
LOG0001620,FURNACE-001,alarm,2025-11-23T23:53:34.167Z,OP7,Aurum deleniti canonicus asperiores depromo tribuo tracto vaco coerceo asporto.
LOG0001621,FURNACE-001,shutdown,2025-10-14T01:30:03.765Z,OP21,Colligo peccatus tersus tam vulgo.
LOG0001622,PRESS-001,maintenance,2026-01-01T16:00:09.216Z,OP23,Natus custodia utroque admoneo decumbo magni tergum ventito umbra.
LOG0001623,CNC-001,alarm,2025-11-25T11:39:49.487Z,OP18,Coruscus approbo curiositas caries dolorum arbor tumultus vinco.
LOG0001624,PRESS-002,shutdown,2026-01-03T18:18:54.779Z,OP4,Comburo cilicium odit tolero vulariter cognomen acceptus.
LOG0001625,FURNACE-001,shutdown,2025-12-02T06:23:38.968Z,OP8,Tempus deprecator dicta damno assumenda.
LOG0001626,CNC-002,production,2025-12-08T04:02:02.713Z,OP23,Rerum valens via tamen abscido patruus.
LOG0001627,WELDER-001,production,2026-01-04T15:54:47.159Z,OP23,Harum conor cuppedia animi accedo.
LOG0001628,WELDER-001,production,2025-10-10T20:16:26.102Z,OP20,Quam dolores civitas attollo denego textus condico auctus ex.
LOG0001629,FURNACE-001,startup,2025-11-24T14:49:30.599Z,OP22,Acidus ab vulgivagus civis desolo brevis utique tersus debeo.
LOG0001630,CNC-001,alarm,2025-12-29T14:35:55.026Z,OP23,Laudantium cunctatio conventus adsum.
LOG0001631,CNC-001,maintenance,2025-10-22T07:42:43.777Z,OP6,Usque uxor tener.
LOG0001632,CNC-001,production,2026-01-24T08:39:54.336Z,OP3,Comedo aggero aspernatur.
LOG0001633,PRESS-002,shutdown,2026-02-10T12:53:07.929Z,OP28,Cunctatio traho vestigium cursus ea textor adipisci casso suscipit.
LOG0001634,PRESS-001,alarm,2025-12-26T23:56:04.744Z,OP9,Apparatus campana audentia.
LOG0001635,CNC-002,alarm,2025-10-12T09:32:39.766Z,OP13,Umbra conqueror vesper speculum corrigo.
LOG0001636,WELDER-001,alarm,2025-10-08T20:42:52.526Z,OP18,Blanditiis vitae ascit pax vere claudeo.
LOG0001637,PRESS-001,startup,2025-10-15T21:07:55.681Z,OP4,Decumbo vis decimus annus dedecor.
LOG0001638,CNC-002,production,2025-10-02T22:07:50.190Z,OP13,Velociter confido admoveo audacia absconditus.
LOG0001639,PRESS-001,production,2025-11-16T12:11:14.548Z,OP11,Careo sum quaerat dens.
LOG0001640,FURNACE-001,alarm,2025-10-02T22:43:25.470Z,OP23,Claro sublime pectus ustilo derelinquo cinis crux trado.
LOG0001641,WELDER-001,alarm,2026-02-04T01:33:03.006Z,OP21,Casso crepusculum certus delectatio ullus victus.
LOG0001642,CNC-002,maintenance,2025-12-13T09:51:32.530Z,OP8,Tantillus alveus suppellex ceno ultra vesica officiis terreo abundans aequus.
LOG0001643,CNC-001,alarm,2025-11-23T20:18:36.873Z,OP24,Cohibeo ademptio teres expedita solium.
LOG0001644,WELDER-001,shutdown,2025-11-26T07:06:25.924Z,OP23,Accendo sodalitas id tactus commodi sollicito suscipit degero.
LOG0001645,CNC-001,production,2026-01-11T12:41:39.510Z,OP4,Voco bos viduo urbanus viscus dolorum nihil cunctatio certe statua.
LOG0001646,WELDER-001,alarm,2025-11-27T09:35:15.808Z,OP29,Blandior vivo confugo brevis decens tepesco apto curriculum aliquam sumo.
LOG0001647,CNC-001,maintenance,2025-10-19T04:32:51.193Z,OP15,Eum demo umquam attonbitus conscendo sublime currus animi.
LOG0001648,CNC-001,startup,2026-02-08T04:28:14.134Z,OP16,Texo crux abbas cubitum colligo.
LOG0001649,WELDER-001,production,2025-11-14T04:02:56.250Z,OP5,Terebro utpote valetudo comis damno.
LOG0001650,WELDER-001,maintenance,2026-01-20T12:54:31.795Z,OP26,Quaerat velociter atqui utor volubilis.
LOG0001651,PRESS-001,maintenance,2025-12-25T21:15:07.953Z,OP10,Coniuratio desparatus urbanus somniculosus aperiam tunc autus aqua cultura abutor.
LOG0001652,PRESS-002,startup,2025-10-25T04:05:35.940Z,OP11,Cetera ver adflicto arcus totam sol amaritudo.
LOG0001653,CNC-002,shutdown,2026-01-02T12:23:41.296Z,OP25,Triduana capitulus demo porro tabella tutis eum vicinus possimus.
LOG0001654,CNC-001,shutdown,2025-12-02T09:31:23.896Z,OP15,Terebro bis viscus color.
LOG0001655,FURNACE-001,shutdown,2025-10-10T10:34:05.409Z,OP5,Thermae constans tibi desipio dolorum cruciamentum traho sit cupio decens.
LOG0001656,PRESS-002,maintenance,2025-10-31T11:41:23.217Z,OP22,Amplitudo stella tumultus statua adipiscor thema benevolentia reiciendis.
LOG0001657,WELDER-001,shutdown,2025-11-24T17:02:09.712Z,OP4,Vilis suppono cedo aegre ustilo constans apparatus cohors balbus somnus.
LOG0001658,PRESS-001,maintenance,2025-11-10T19:44:51.086Z,OP8,Demens suscipit nam subvenio approbo substantia virtus derelinquo veritas utique.
