log_id,equipment_id,event_type,timestamp,operator_id,message
LOG0002134,CNC-002,alarm,2025-11-29T08:29:54.630Z,OP30,Conforto annus contra demergo correptius aedificium crinis.
LOG0002135,CNC-002,startup,2026-01-27T08:14:08.638Z,OP17,Copiose cedo denique cupressus creo.
LOG0002136,PRESS-002,alarm,2026-01-29T05:00:10.000Z,OP27,Inflammatio cursim combibo explicabo quisquam aestus depulso virga.
LOG0002137,CNC-002,production,2025-10-11T17:01:34.897Z,OP19,Conqueror crustulum dolore maiores tametsi amicitia cubo dens ustilo.
LOG0002138,PRESS-001,startup,2026-01-19T20:07:45.578Z,OP25,Sustineo substantia stella decens fugiat usque correptius voveo.
LOG0002139,CNC-002,production,2026-01-07T14:28:19.432Z,OP8,Carbo synagoga casus arguo triumphus desino dolorem vulgivagus patruus.
LOG0002140,FURNACE-001,startup,2025-12-13T00:37:07.744Z,OP30,Ambitus at ventito curtus vester acquiro.
LOG0002141,WELDER-001,shutdown,2026-02-09T01:20:52.709Z,OP8,Turpis correptius cunctatio accommodo conqueror atavus vilis vito.
LOG0002142,FURNACE-001,shutdown,2026-01-25T12:03:29.272Z,OP21,Vulnero curto apud conscendo acidus civitas sophismata auctor.
LOG0002143,PRESS-002,production,2026-02-01T04:20:25.771Z,OP7,Deporto coma alter bene amitto cohibeo tersus.
LOG0002144,WELDER-001,production,2026-01-16T22:09:41.730Z,OP19,Carbo adfectus armarium pecus tempora.
LOG0002145,CNC-001,alarm,2025-11-16T02:33:57.580Z,OP19,Iste damno confido certus strues.
LOG0002146,WELDER-001,alarm,2025-11-10T15:52:05.518Z,OP21,Vociferor aro comptus alo arbustum ipsa.
LOG0002147,PRESS-002,alarm,2025-10-18T13:04:48.477Z,OP26,Speciosus admoneo aeternus arx utor decet depulso vorago cursus.
LOG0002148,CNC-001,shutdown,2026-01-18T15:17:37.570Z,OP27,Doloribus repellat articulus volaticus ara viscus aperio curriculum sed.
LOG0002149,CNC-002,maintenance,2025-11-29T01:19:58.021Z,OP14,Adduco crux supplanto distinctio delectatio tandem ab considero statim clementia.
LOG0002150,PRESS-002,shutdown,2025-11-29T03:45:24.402Z,OP4,Tenuis deprimo amet acer molestias.
LOG0002151,CNC-002,production,2025-11-11T02:46:04.836Z,OP7,Comedo sustineo conturbo conservo.
LOG0002152,CNC-001,shutdown,2026-02-03T14:49:09.745Z,OP6,Vulgaris carpo congregatio consuasor cur.
LOG0002153,PRESS-002,startup,2025-10-29T09:00:08.506Z,OP22,Tamen appono pauci thymum bene bellicus ratione atque curis.
LOG0002154,CNC-002,maintenance,2026-01-28T22:04:59.100Z,OP4,Deinde allatus adipisci creator deripio.
LOG0002155,PRESS-002,maintenance,2025-11-29T15:39:25.391Z,OP14,Timidus umquam blanditiis cena degero.
LOG0002156,WELDER-001,alarm,2025-12-12T08:05:08.019Z,OP18,Creptio comptus spero non bestia vivo vulnus.
LOG0002157,PRESS-002,production,2025-10-27T16:35:52.954Z,OP17,Adamo vulpes talus.
LOG0002158,WELDER-001,startup,2026-01-08T07:19:44.276Z,OP22,Omnis valetudo auctus nostrum.
LOG0002159,PRESS-002,shutdown,2025-11-06T22:13:14.276Z,OP18,Consectetur civitas vesco statim ad tendo thalassinus textor venustas.
LOG0002160,CNC-002,shutdown,2025-11-16T19:49:53.481Z,OP24,Conicio magnam tenus comminor thermae.
LOG0002161,WELDER-001,startup,2026-01-09T06:10:27.146Z,OP4,Natus solio ratione peccatus sursum solus.
LOG0002162,CNC-001,maintenance,2025-10-07T19:24:29.288Z,OP3,Administratio comitatus sumptus volubilis accusator antepono vilis caveo tactus spes.
LOG0002163,CNC-001,maintenance,2025-11-01T21:54:06.131Z,OP13,Solutio tamquam velit trans vapulus omnis dolorem.
LOG0002164,FURNACE-001,alarm,2025-12-15T12:21:49.064Z,OP24,Vereor conforto unus teres id sodalitas approbo dens spectaculum virgo.
LOG0002165,CNC-001,maintenance,2025-12-25T05:08:19.457Z,OP21,Attollo usque catena decor decretum aeternus.
LOG0002166,CNC-001,production,2025-12-22T22:15:45.015Z,OP21,Ut accusator capto perferendis ago suggero.
LOG0002167,PRESS-001,alarm,2025-10-15T00:36:18.826Z,OP16,Defessus volaticus aut distinctio pecus acidus facere.
LOG0002168,CNC-001,startup,2026-01-03T04:15:14.116Z,OP20,Casus depraedor abeo tibi turba alter uterque vere utroque considero.
LOG0002169,PRESS-002,maintenance,2025-12-22T17:09:53.732Z,OP3,Laudantium deripio recusandae volubilis.
LOG0002170,CNC-001,shutdown,2025-10-13T04:42:03.584Z,OP15,Textor talis dapifer conscendo sed bibo velut cito.
LOG0002171,FURNACE-001,alarm,2026-02-06T03:58:25.044Z,OP16,Vobis coniuratio victoria placeat.
LOG0002172,PRESS-001,startup,2025-11-16T13:09:26.034Z,OP15,Magnam cilicium cimentarius iste deduco audax aestus aiunt compello.
LOG0002173,CNC-002,shutdown,2025-12-30T20:28:27.502Z,OP4,Tepesco ipsum aut carmen consequuntur nobis est bis.
LOG0002174,CNC-002,startup,2026-01-14T16:59:18.180Z,OP30,Thalassinus pecco arbustum tollo temperantia artificiose vitae iste cimentarius vigor.
LOG0002175,PRESS-002,startup,2026-02-07T07:01:59.065Z,OP5,Candidus adipisci centum.
LOG0002176,CNC-001,shutdown,2026-02-09T19:37:37.316Z,OP28,Administratio cunae at.
LOG0002177,FURNACE-001,maintenance,2025-12-23T23:39:38.756Z,OP4,Benevolentia sufficio cura sequi animadverto tumultus asporto hic eum.
LOG0002178,PRESS-001,startup,2026-01-24T14:38:30.630Z,OP17,Titulus beatus denuo.
LOG0002179,CNC-002,startup,2025-11-08T10:48:12.879Z,OP22,Acerbitas laudantium ante creo delibero aestus comedo.
LOG0002180,PRESS-002,startup,2025-10-12T20:30:06.028Z,OP7,Speciosus arbitro viduo tergiversatio non deduco absque absorbeo corona crastinus.
LOG0002181,CNC-002,shutdown,2026-01-15T22:45:25.605Z,OP11,Coadunatio vae stips advoco eius corrupti.
LOG0002182,PRESS-002,startup,2025-12-28T19:07:50.147Z,OP19,Barba adulatio verecundia audacia tam adiuvo pecco vester adeptio.
LOG0002183,PRESS-002,startup,2025-11-27T06:59:59.017Z,OP3,Collum suasoria benigne cribro.
LOG0002184,PRESS-001,shutdown,2025-12-21T02:03:32.855Z,OP30,Tenuis copia neque corroboro.
LOG0002185,CNC-002,startup,2026-01-22T20:34:35.282Z,OP18,Appello suggero tabgo coerceo stella cariosus stabilis cogo bibo quos.
LOG0002186,WELDER-001,alarm,2025-12-03T08:35:26.325Z,OP10,Cum temptatio considero casso denique voveo abeo inflammatio.
LOG0002187,CNC-002,maintenance,2026-01-30T19:07:27.846Z,OP18,Stillicidium cohors adhaero.
LOG0002188,PRESS-002,shutdown,2025-11-16T23:02:16.051Z,OP5,Umquam charisma vicissitudo ulterius derelinquo alienus curto varietas talis unus.
LOG0002189,CNC-002,alarm,2025-11-29T10:04:53.293Z,OP13,Depulso umquam enim usque.
LOG0002190,WELDER-001,startup,2025-11-11T22:17:46.731Z,OP2,Cito sursum confugo pecco balbus crinis adfero.
LOG0002191,CNC-001,production,2025-11-01T13:08:10.053Z,OP24,Approbo caveo ulterius amo.
LOG0002192,PRESS-002,maintenance,2026-02-08T08:38:55.717Z,OP2,Contego vilicus cum paens.
LOG0002193,PRESS-001,production,2025-12-23T12:58:04.750Z,OP4,Bardus uberrime viduo adsidue.
LOG0002194,PRESS-002,maintenance,2026-02-04T18:27:34.245Z,OP29,Copiose trucido spectaculum.
LOG0002195,FURNACE-001,shutdown,2025-11-08T17:11:33.226Z,OP11,Ocer vulgus recusandae pecto comptus.
LOG0002196,FURNACE-001,maintenance,2026-01-03T22:43:25.782Z,OP4,Campana vivo at tergo acerbitas temptatio inflammatio articulus laudantium.
LOG0002197,WELDER-001,startup,2026-01-30T16:38:56.810Z,OP14,Tredecim vulgo venio clamo caecus amiculum verumtamen eos.
LOG0002198,PRESS-001,startup,2025-10-26T03:26:07.352Z,OP13,Vesper totidem corpus absorbeo deporto bene amplitudo accedo damnatio repellendus.
LOG0002199,FURNACE-001,startup,2026-01-15T17:26:23.856Z,OP3,Delectus avarus tero audacia ultra sponte valeo.
LOG0002200,PRESS-001,alarm,2025-10-19T03:02:08.500Z,OP24,Benevolentia patrocinor cerno ultio viriliter theatrum.
LOG0002201,PRESS-001,alarm,2026-01-17T05:34:18.053Z,OP19,Aiunt doloribus amitto urbanus arcus laboriosam.
LOG0002202,WELDER-001,shutdown,2025-12-25T06:19:50.895Z,OP11,Tumultus doloribus aer non tunc argumentum.
LOG0002203,FURNACE-001,maintenance,2025-10-18T01:25:49.129Z,OP9,Decor combibo depopulo teneo clamo adicio una sustineo.
LOG0002204,CNC-001,maintenance,2025-12-25T08:25:21.235Z,OP1,Dignissimos degero animadverto.
LOG0002205,CNC-002,shutdown,2026-01-09T19:43:08.426Z,OP5,Comminor currus ultio allatus sordeo.
LOG0002206,PRESS-001,maintenance,2026-01-09T23:33:27.447Z,OP3,Cui umquam succurro antea tenetur umquam aspicio cohaero sequi eaque.
LOG0002207,WELDER-001,production,2025-11-10T03:27:57.525Z,OP30,Cedo taedium contigo consequuntur voluptatibus vulariter bardus viscus vado cometes.
LOG0002208,WELDER-001,maintenance,2026-01-21T11:36:14.370Z,OP19,Terror tempora vigilo.
LOG0002209,WELDER-001,alarm,2026-01-30T12:05:05.585Z,OP15,Aestivus succurro alii ex.
LOG0002210,WELDER-001,alarm,2025-12-26T02:57:40.604Z,OP26,Dapifer acervus ipsam capto ut quasi volo.
LOG0002211,FURNACE-001,maintenance,2025-12-26T09:34:53.794Z,OP21,Amiculum somnus color turba cras colo ustilo turbo.
LOG0002212,CNC-001,production,2026-01-10T04:47:43.554Z,OP24,Desparatus totidem aggero vergo arma fuga.
LOG0002213,WELDER-001,startup,2026-02-05T11:54:13.927Z,OP22,Aestas adeptio curis delectus sollers tenuis.
LOG0002214,CNC-002,startup,2026-01-05T04:42:52.479Z,OP20,Tabernus aestivus commodi creo audeo aliqua.
LOG0002215,FURNACE-001,production,2025-10-13T21:11:41.031Z,OP3,Sapiente bellicus deserunt.
LOG0002216,FURNACE-001,alarm,2025-11-12T09:35:41.041Z,OP13,Adversus vorago custodia mollitia adfero victoria claudeo acceptus supellex cubo.
LOG0002217,PRESS-001,alarm,2025-10-17T22:16:13.180Z,OP20,Aduro demulceo apparatus stabilis molestiae.
LOG0002218,WELDER-001,shutdown,2026-01-08T08:13:55.140Z,OP20,Cibo suggero aranea textor adsum desidero rerum maxime.
LOG0002219,FURNACE-001,shutdown,2025-10-15T19:12:15.738Z,OP22,Vulgaris tantum video enim depono eveniet solutio venio blandior terra.
LOG0002220,WELDER-001,maintenance,2025-10-06T15:03:54.072Z,OP19,Arguo alienus delinquo.
LOG0002221,WELDER-001,startup,2025-10-09T01:01:55.869Z,OP6,Vigilo angulus absque conforto cilicium volutabrum catena saepe incidunt.
LOG0002222,CNC-002,startup,2026-02-03T09:58:32.123Z,OP7,Apud suppellex facilis odit veritas aptus conturbo mollitia valens textor.
LOG0002223,PRESS-002,production,2026-01-30T23:03:21.831Z,OP5,Comparo communis argentum adipisci veritas.
LOG0002224,PRESS-002,shutdown,2026-01-19T03:50:17.179Z,OP29,Statua crux atrocitas comes trado recusandae agnitio spectaculum deduco necessitatibus.
LOG0002225,WELDER-001,shutdown,2026-01-16T02:54:43.244Z,OP1,Acceptus xiphias copia cedo.
LOG0002226,WELDER-001,alarm,2025-10-28T21:19:52.350Z,OP23,Conscendo absconditus coadunatio vulpes arto tabula consectetur.
LOG0002227,WELDER-001,startup,2026-01-08T20:23:19.573Z,OP24,Supra voveo audentia.
LOG0002228,PRESS-001,maintenance,2025-12-02T00:57:18.235Z,OP16,Calculus delibero iste atrox volaticus cogito a comprehendo acer villa.
LOG0002229,CNC-002,startup,2026-01-30T00:31:17.572Z,OP2,Abscido centum spectaculum crepusculum cornu cilicium via consuasor carbo.
LOG0002230,PRESS-001,maintenance,2025-11-01T07:29:57.030Z,OP22,Voluptas utrum solium.
LOG0002231,FURNACE-001,maintenance,2025-12-10T13:50:44.560Z,OP15,Ascit admoneo apto deputo dignissimos assentator demitto catena cervus.
LOG0002232,WELDER-001,maintenance,2025-12-09T04:06:09.333Z,OP28,Advoco cetera tamdiu curo turbo varius admitto.
LOG0002233,CNC-001,maintenance,2025-10-26T12:03:41.444Z,OP1,Tabesco ultio defessus deludo spes.
LOG0002234,CNC-001,startup,2026-01-04T07:10:55.009Z,OP6,Cognatus delibero bis contego abscido brevis harum tripudio terebro.
LOG0002235,WELDER-001,production,2025-10-15T00:23:52.948Z,OP12,Demergo facilis alveus surculus.
LOG0002236,CNC-001,maintenance,2026-01-23T09:05:19.498Z,OP17,Cattus voluptas adstringo voluptas validus.
LOG0002237,CNC-002,shutdown,2025-11-13T23:11:22.134Z,OP16,Ait cruciamentum inflammatio.
LOG0002238,PRESS-001,startup,2026-01-12T16:27:24.047Z,OP25,Arcesso sustineo vulpes.
LOG0002239,WELDER-001,startup,2025-12-29T10:16:47.131Z,OP3,Delinquo occaecati amplexus caterva demergo consectetur tertius.
LOG0002240,WELDER-001,maintenance,2025-10-23T02:37:41.945Z,OP7,Attonbitus cinis tribuo verto callide varietas tabgo capitulus autus.
LOG0002241,PRESS-001,shutdown,2025-12-04T20:15:50.472Z,OP6,Ipsa caterva conspergo ver venustas uredo alioqui.
LOG0002242,FURNACE-001,shutdown,2025-10-18T13:03:00.110Z,OP21,Vaco tactus vulnero allatus tabella.
LOG0002243,CNC-001,alarm,2025-10-27T11:52:19.687Z,OP24,Est aeternus animadverto accusamus depromo agnosco.
LOG0002244,CNC-002,production,2025-11-25T15:30:43.666Z,OP27,Ademptio allatus fugiat coniuratio defaeco velum adulatio ars commodo derideo.
LOG0002245,CNC-001,startup,2026-01-02T01:21:10.201Z,OP10,Repellat atqui defluo sed cubitum conicio alii cauda.
LOG0002246,PRESS-002,shutdown,2026-01-10T20:24:24.126Z,OP29,Amor carus venio.
LOG0002247,CNC-001,production,2025-10-27T08:21:52.703Z,OP24,Coepi adamo valetudo voluptatem acidus.
LOG0002248,CNC-002,alarm,2026-02-04T10:44:48.708Z,OP1,Triduana aperiam sponte thorax dedecor vos sordeo conturbo cibo cotidie.
LOG0002249,PRESS-002,maintenance,2025-10-18T12:22:04.238Z,OP11,Aranea cariosus statim eum defetiscor illum adinventitias ambitus vulnus sub.
LOG0002250,CNC-001,maintenance,2025-12-17T05:05:37.077Z,OP2,Attero adsuesco veritas.
LOG0002251,PRESS-001,alarm,2025-10-31T17:13:50.154Z,OP11,Amoveo custodia excepturi ancilla thalassinus.
LOG0002252,CNC-001,alarm,2025-11-23T23:50:17.482Z,OP22,Creta sustineo vere defendo vesper complectus tergo.
LOG0002253,FURNACE-001,shutdown,2025-12-15T18:43:44.743Z,OP18,Texo spoliatio molestias sui cernuus ut vulticulus at a.
LOG0002254,CNC-002,production,2025-11-03T16:09:39.604Z,OP19,Derideo civitas sapiente cultellus eius demergo cui clementia soleo synagoga.
LOG0002255,WELDER-001,alarm,2026-02-06T15:00:37.397Z,OP7,Adulescens adaugeo ara denego reprehenderit.
LOG0002256,PRESS-002,alarm,2025-11-28T04:00:12.734Z,OP27,Desino arto cupiditas socius beatus amiculum brevis triumphus cavus.
LOG0002257,FURNACE-001,alarm,2025-12-25T10:59:20.677Z,OP2,Certe laudantium timor terreo degero.
LOG0002258,WELDER-001,production,2025-12-18T16:23:35.434Z,OP25,Sumptus victus copiose aestas antea conor.
LOG0002259,WELDER-001,shutdown,2026-01-15T12:51:01.446Z,OP10,Ver tubineus vobis carus sonitus victus voluptatibus textor ultio vulnus.
LOG0002260,PRESS-001,production,2026-02-07T16:53:42.705Z,OP15,Deduco desipio abstergo demitto theatrum cupio denuo ex temptatio infit.
LOG0002261,PRESS-002,shutdown,2026-01-28T04:55:15.528Z,OP11,Umerus decumbo varius inflammatio triumphus accendo reiciendis.
LOG0002262,FURNACE-001,production,2025-10-15T15:16:19.281Z,OP4,Non voluptatem celo.
LOG0002263,FURNACE-001,startup,2025-12-04T22:16:35.924Z,OP6,Ara crur carmen sit tepesco sophismata.
LOG0002264,PRESS-002,maintenance,2025-12-04T01:12:36.359Z,OP12,Venio amoveo deserunt.
LOG0002265,WELDER-001,maintenance,2025-12-12T04:20:03.502Z,OP9,Quibusdam derelinquo termes concedo usus texo textus aperiam spiritus maxime.
LOG0002266,CNC-001,maintenance,2026-01-11T02:48:47.642Z,OP13,Traho surgo tandem civitas.
LOG0002267,CNC-002,maintenance,2025-10-21T03:58:36.310Z,OP6,Surgo antiquus deporto cuius.
LOG0002268,WELDER-001,production,2025-10-12T08:13:44.690Z,OP24,Celebrer sum voluptatum civitas spiculum incidunt theca claustrum apostolus sulum.
LOG0002269,PRESS-002,shutdown,2025-11-06T17:23:52.144Z,OP11,Totam magni spes valetudo tristis solutio voluptatibus nisi conspergo capio.
LOG0002270,CNC-001,shutdown,2026-02-02T04:59:36.894Z,OP30,Appositus omnis conculco beatus.
LOG0002271,WELDER-001,startup,2025-12-01T09:21:22.247Z,OP10,Subseco demoror tabgo.
LOG0002272,PRESS-002,startup,2025-11-01T17:24:25.665Z,OP2,Alveus officiis ipsa admitto nobis contabesco consequatur claudeo terebro.
LOG0002273,CNC-002,startup,2025-12-19T10:04:28.886Z,OP30,Adopto villa eos.
LOG0002274,PRESS-002,maintenance,2026-01-19T21:53:46.824Z,OP15,Corpus repudiandae cado vitae anser assentator subito tredecim depopulo.
LOG0002275,CNC-001,alarm,2025-10-11T06:20:02.854Z,OP8,Auctor angustus terror conturbo molestiae magnam defetiscor decumbo ambulo.
LOG0002276,FURNACE-001,alarm,2025-10-29T13:04:39.734Z,OP25,Supplanto utpote condico corroboro conor arx attero.
LOG0002277,PRESS-002,production,2025-12-29T23:10:17.275Z,OP21,Vorax amplexus debitis admoveo dolorem comparo bene conatus.
LOG0002278,CNC-001,shutdown,2026-01-09T05:32:58.606Z,OP18,Amoveo tracto demitto quidem abutor varietas illum corrigo urbanus temporibus.
LOG0002279,PRESS-002,production,2026-01-09T07:15:34.353Z,OP15,Adipiscor vociferor eius aestus voveo.
LOG0002280,WELDER-001,alarm,2025-12-03T11:58:12.815Z,OP26,Cornu id beatus coruscus ara deprimo urbanus conforto.
LOG0002281,CNC-002,production,2026-01-04T12:56:36.671Z,OP27,Provident necessitatibus uberrime constans in carus repellat.
LOG0002282,PRESS-001,shutdown,2025-12-19T23:14:28.323Z,OP29,Tener eaque totam contabesco caecus porro defungo subnecto aufero toties.
LOG0002283,WELDER-001,alarm,2026-02-07T05:04:21.273Z,OP18,Nihil ademptio subiungo curriculum adulatio laborum cedo terminatio.
LOG0002284,PRESS-001,production,2026-02-02T13:13:21.778Z,OP17,Coniecto bestia cedo attollo aeger autus approbo super termes.
LOG0002285,PRESS-001,startup,2026-02-12T10:47:13.732Z,OP9,Fuga tubineus defleo defessus quisquam.
LOG0002286,FURNACE-001,alarm,2026-01-31T16:48:44.015Z,OP27,Causa absum terreo capillus adnuo vinum.
LOG0002287,PRESS-002,alarm,2025-10-22T06:26:56.400Z,OP10,Attero velum ante.
LOG0002288,PRESS-002,shutdown,2025-11-18T02:16:17.453Z,OP18,Tempora tunc aut vulpes altus crinis vivo adduco.
LOG0002289,FURNACE-001,shutdown,2026-01-15T20:20:15.349Z,OP29,Nostrum debilito aggredior armarium confido depono verecundia.
LOG0002290,FURNACE-001,alarm,2025-11-24T18:23:39.953Z,OP2,Tabella careo cito tandem viriliter absorbeo cunctatio ante comminor creo.
LOG0002291,FURNACE-001,startup,2025-12-19T04:17:15.102Z,OP1,Audeo tepesco commodi cupio socius id vicinus succedo tyrannus caelum.
LOG0002292,PRESS-001,maintenance,2025-12-16T18:14:44.842Z,OP2,Repudiandae ventito admitto voluptates civis cicuta.
LOG0002293,WELDER-001,alarm,2026-01-28T07:17:16.670Z,OP24,Attollo conforto crux urbs ciminatio.
LOG0002294,PRESS-001,shutdown,2025-11-01T14:22:29.426Z,OP1,Dignissimos virgo claudeo aestas.
LOG0002295,FURNACE-001,production,2026-01-27T01:45:53.726Z,OP9,Exercitationem varietas aranea valetudo expedita curto umquam peior summisse.
LOG0002296,CNC-002,shutdown,2025-11-27T12:17:23.361Z,OP15,Laboriosam spes apparatus trado addo coniecto pariatur sapiente summa curso.
LOG0002297,PRESS-002,alarm,2025-11-28T09:53:24.294Z,OP25,Auditor admitto cuius iusto consequuntur accendo vix acquiro casso.
LOG0002298,PRESS-002,alarm,2025-10-27T12:29:48.178Z,OP27,Turba aperte conforto canis cervus tantum claudeo nostrum cimentarius umerus.
LOG0002299,PRESS-002,startup,2025-12-23T12:59:21.538Z,OP28,Deinde comprehendo antea rem deduco conculco vehemens adstringo succurro.
LOG0002300,CNC-002,maintenance,2025-12-30T11:01:21.221Z,OP8,Ager taedium incidunt atrocitas acervus adimpleo pectus alias.
LOG0002301,PRESS-002,maintenance,2025-12-24T05:28:26.209Z,OP20,Facere considero adiuvo adulescens custodia abbas cruciamentum advenio thymum vergo.
LOG0002302,PRESS-002,shutdown,2025-12-04T23:10:04.051Z,OP26,Acquiro utilis aegrus conturbo vorax cursus arma ullam.
LOG0002303,WELDER-001,startup,2025-10-08T22:08:19.167Z,OP25,Pel adsuesco templum theatrum aegrus atavus subseco.
LOG0002304,PRESS-002,startup,2026-01-14T07:55:02.765Z,OP7,Beatae circumvenio vesica crinis vulgo reprehenderit stipes dapifer.
LOG0002305,PRESS-001,maintenance,2025-11-16T19:13:51.667Z,OP11,Casus vestrum comedo deorsum cui.
LOG0002306,PRESS-002,production,2025-10-27T11:27:42.167Z,OP27,Ocer texo velit ascit earum depromo subnecto.
LOG0002307,CNC-002,production,2025-11-03T22:30:04.810Z,OP29,Amplitudo appositus alioqui thalassinus quisquam tempore.
LOG0002308,PRESS-002,shutdown,2025-12-09T09:59:13.919Z,OP27,Caute censura correptius.
LOG0002309,FURNACE-001,maintenance,2025-11-11T09:04:40.947Z,OP16,Absconditus caelestis sequi brevis appono quae celo.
LOG0002310,PRESS-001,production,2025-12-05T16:36:07.013Z,OP20,Audeo terra tamen basium coruscus.
LOG0002311,FURNACE-001,production,2026-01-16T04:15:09.200Z,OP7,Eius tergo timor.
LOG0002312,PRESS-001,startup,2025-12-14T01:03:52.835Z,OP2,Comparo cogito suppono conicio.
LOG0002313,CNC-001,startup,2025-10-19T03:16:38.569Z,OP25,Dolore decumbo alienus patrocinor nihil.
LOG0002314,PRESS-002,production,2025-12-18T15:55:19.130Z,OP8,Clarus voluptatem vulgo dicta similique timidus currus angelus allatus adipiscor.
LOG0002315,PRESS-002,shutdown,2025-12-07T13:13:17.581Z,OP1,Occaecati accusator voluptates ascit aptus desidero.
LOG0002316,PRESS-001,shutdown,2026-02-11T11:54:54.630Z,OP20,Arceo denuncio amissio peccatus.
LOG0002317,FURNACE-001,production,2026-01-08T01:48:38.271Z,OP3,Apud claro infit tam addo timor animus combibo nisi.
LOG0002318,PRESS-002,shutdown,2025-11-06T18:38:58.446Z,OP30,Delectus causa aliquid tenax sponte tergo paens bellicus turpis defaeco.
LOG0002319,FURNACE-001,maintenance,2025-11-05T15:47:12.714Z,OP27,Tenetur volutabrum tripudio careo apostolus pariatur cicuta.
LOG0002320,CNC-001,alarm,2025-12-04T21:49:07.471Z,OP1,Id vehemens tepesco cena.
LOG0002321,CNC-001,maintenance,2025-10-20T08:44:28.723Z,OP18,Aperte thesis capto tabgo cui numquam.
LOG0002322,PRESS-002,production,2026-02-08T14:32:07.152Z,OP27,Addo depromo comitatus copia theologus alius averto odio.
LOG0002323,PRESS-001,alarm,2025-12-03T04:54:01.852Z,OP18,Varietas facilis similique stultus non confido.
LOG0002324,CNC-002,shutdown,2025-10-31T10:10:34.230Z,OP13,Temeritas acies cursus cupio stipes peccatus.
LOG0002325,PRESS-001,production,2025-11-24T05:06:04.254Z,OP17,Voluptas alveus campana ciminatio stips villa.
LOG0002326,CNC-001,alarm,2025-10-07T22:01:34.358Z,OP24,Repellat rem tantum.
LOG0002327,FURNACE-001,shutdown,2026-01-31T18:51:20.679Z,OP17,Celebrer amoveo alioqui curto arguo thalassinus studio testimonium claro cura.
LOG0002328,FURNACE-001,shutdown,2025-11-17T03:55:55.823Z,OP5,Cursim cervus voluptatum.
LOG0002329,FURNACE-001,startup,2025-12-27T08:21:39.084Z,OP12,Statua solutio corpus annus veritas.
LOG0002330,FURNACE-001,maintenance,2026-02-12T18:10:59.122Z,OP24,Suasoria tracto strenuus uxor magni angustus ceno strues abstergo.
LOG0002331,PRESS-001,production,2025-10-21T06:05:40.775Z,OP4,Vetus vado triduana umbra curiositas teneo aperte crur talio.
LOG0002332,PRESS-001,shutdown,2025-11-20T13:43:26.359Z,OP8,Quisquam arbitro strenuus cogito super.
LOG0002333,FURNACE-001,alarm,2025-10-31T00:14:55.745Z,OP7,Utrimque deleniti antepono pax tam benigne administratio.
LOG0002334,CNC-001,shutdown,2025-11-25T06:39:09.384Z,OP3,Abeo adduco comptus subnecto iste articulus sto.
LOG0002335,FURNACE-001,shutdown,2025-10-08T01:22:07.853Z,OP11,Victoria peior expedita cultellus.
LOG0002336,CNC-001,startup,2026-01-06T17:39:21.711Z,OP4,Tener cupressus amiculum.
LOG0002337,WELDER-001,startup,2026-02-08T00:56:24.128Z,OP24,Cresco agnosco facere appello desolo censura creptio aduro.
LOG0002338,CNC-002,maintenance,2025-10-15T18:23:38.567Z,OP23,Ubi dignissimos voluptas doloribus.
LOG0002339,FURNACE-001,shutdown,2025-11-30T06:51:37.272Z,OP5,Copia fugit tantillus molestias possimus chirographum verus acervus trucido.
LOG0002340,PRESS-002,shutdown,2025-11-21T04:26:21.236Z,OP6,Super auditor ipsa.
LOG0002341,PRESS-001,alarm,2026-01-07T15:57:20.567Z,OP21,Supplanto ducimus peccatus toties facere.
LOG0002342,CNC-001,alarm,2025-11-23T17:10:27.701Z,OP7,Vomer terebro consequuntur perferendis urbs artificiose occaecati theatrum.
LOG0002343,CNC-001,alarm,2025-11-13T04:40:26.553Z,OP22,Tabesco asperiores amaritudo tempora aveho vociferor aetas.
LOG0002344,CNC-001,maintenance,2025-10-27T04:26:16.570Z,OP1,Circumvenio vorax excepturi torrens virga ubi ultra.
LOG0002345,PRESS-002,startup,2025-11-28T11:14:14.372Z,OP23,Turba confugo thalassinus quia agnosco ipsam alii comparo.
LOG0002346,PRESS-002,startup,2025-10-17T22:11:09.767Z,OP24,Vinum adicio statim cubo.
LOG0002347,FURNACE-001,maintenance,2026-01-28T14:32:49.322Z,OP19,Viriliter vere tersus conventus crux eos coepi voro vetus.
LOG0002348,PRESS-002,shutdown,2025-12-15T22:48:35.942Z,OP28,Derideo depono acsi inflammatio tredecim sollicito.
LOG0002349,PRESS-001,alarm,2026-02-03T01:49:06.335Z,OP24,Sunt demitto desparatus caste.
LOG0002350,PRESS-002,alarm,2025-11-17T07:33:58.491Z,OP16,Peccatus dolores cohibeo tactus toties.
LOG0002351,CNC-001,production,2026-01-30T11:39:21.672Z,OP18,Suppellex adeo vehemens aestus aggredior sublime argentum adnuo.
LOG0002352,FURNACE-001,maintenance,2026-01-02T17:01:45.543Z,OP10,Autus pel quo curriculum strenuus valetudo cogito.
LOG0002353,FURNACE-001,shutdown,2026-01-01T20:00:09.135Z,OP26,Angustus cupio laboriosam cras trado.
LOG0002354,WELDER-001,production,2025-11-12T21:45:09.795Z,OP28,Cibus repellat decerno veritas aggredior clementia audeo cubitum sto.
LOG0002355,CNC-002,production,2026-01-30T00:55:21.017Z,OP23,Cilicium omnis decens.
LOG0002356,FURNACE-001,alarm,2025-10-21T14:03:10.995Z,OP9,Suspendo adipisci denique verbera sophismata.
LOG0002357,PRESS-002,shutdown,2026-01-21T02:04:17.385Z,OP19,Clam apud tempora verus deprimo vereor quia averto solum.
LOG0002358,WELDER-001,maintenance,2025-11-09T12:30:05.432Z,OP10,Porro suppono ulterius totidem depereo audax clarus comminor velum.
LOG0002359,WELDER-001,alarm,2026-02-04T17:44:29.107Z,OP15,Solum cresco verus umquam ambulo labore.
LOG0002360,WELDER-001,alarm,2026-01-30T14:30:27.039Z,OP16,Caveo viscus calculus tego molestias celer congregatio.
LOG0002361,PRESS-001,shutdown,2026-01-26T12:24:55.407Z,OP15,Colligo varietas tepidus.
LOG0002362,PRESS-002,shutdown,2025-12-31T12:06:47.963Z,OP27,Id blandior solus vado deripio catena subiungo.
LOG0002363,FURNACE-001,startup,2026-01-02T01:32:00.526Z,OP27,Spes vulgus statim adsidue clibanus culpa.
LOG0002364,CNC-002,maintenance,2025-10-17T02:16:50.447Z,OP4,Cohaero deprimo vinitor textilis.
LOG0002365,CNC-002,maintenance,2026-01-21T19:26:04.786Z,OP14,Voluptate damno sumo tepesco.
LOG0002366,PRESS-001,shutdown,2026-01-12T03:24:21.191Z,OP28,Tricesimus absconditus cattus iure.
LOG0002367,CNC-001,maintenance,2025-12-07T20:21:46.499Z,OP14,Vomer validus spiritus.
