log_id,equipment_id,event_type,timestamp,operator_id,message
LOG0000001,WELDER-001,maintenance,2025-12-06T21:40:36.009Z,OP14,Tripudio torqueo cuppedia quo quam verbera thesis vetus delicate tabesco.
LOG0000002,WELDER-001,startup,2026-01-24T18:25:30.769Z,OP6,Decens adulescens vestrum acies verecundia spes ulterius arguo deporto.
LOG0000003,WELDER-001,maintenance,2026-01-16T23:59:00.206Z,OP29,Repudiandae auctor quidem curto paens adulescens tergum uterque.
LOG0000004,CNC-001,maintenance,2025-10-09T10:44:47.117Z,OP10,Eligendi virgo damnatio volo sodalitas torqueo verto.
LOG0000005,CNC-002,production,2026-01-14T22:46:13.784Z,OP4,Bene creta utpote iure bestia stultus supra tandem.
LOG0000006,CNC-001,maintenance,2026-01-11T00:03:46.463Z,OP17,Tepidus explicabo temptatio adfectus clamo vomica.
LOG0000007,WELDER-001,alarm,2026-01-17T23:52:36.532Z,OP17,Substantia solum nulla quia concedo iste dicta demitto.
LOG0000008,FURNACE-001,shutdown,2026-01-05T09:36:49.099Z,OP15,Cohors tristis defungo creber.
LOG0000009,PRESS-002,alarm,2025-12-17T15:23:19.280Z,OP10,Concido ambitus ascit soluta conduco magni suspendo argentum acquiro.
LOG0000010,PRESS-001,shutdown,2025-11-20T10:34:08.738Z,OP6,Somnus crebro venio temporibus vergo adflicto vinco asporto reprehenderit decens.
LOG0000011,PRESS-001,maintenance,2025-12-29T06:47:02.210Z,OP5,Cilicium umbra doloribus corpus thymbra calamitas aestivus.
LOG0000012,FURNACE-001,shutdown,2025-10-04T07:00:47.821Z,OP14,Aggredior admiratio texo cunctatio conicio.
LOG0000013,WELDER-001,startup,2025-10-21T20:35:13.227Z,OP23,Uberrime vere saepe stips contigo deficio totidem constans.
LOG0000014,WELDER-001,shutdown,2025-11-08T12:28:07.429Z,OP1,Abutor tam charisma cado studio vesper adicio summopere audentia.
LOG0000015,FURNACE-001,maintenance,2026-01-19T07:33:16.700Z,OP11,Argentum crastinus circumvenio curatio dens dolor.
LOG0000016,CNC-001,startup,2025-11-26T02:54:28.375Z,OP17,Demens expedita casus trans somniculosus veritatis alii.
LOG0000017,WELDER-001,startup,2025-11-05T05:13:56.005Z,OP10,Concido triduana repellat surculus video thymbra.
LOG0000018,PRESS-001,production,2025-11-16T08:55:02.373Z,OP22,Correptius pecto animadverto artificiose colligo.
LOG0000019,WELDER-001,shutdown,2025-10-10T20:13:56.736Z,OP2,Deprecator ullus tantillus temperantia debilito auxilium ustulo suffoco.
LOG0000020,PRESS-002,alarm,2025-12-14T21:40:10.083Z,OP27,Id degusto ascisco virgo.
LOG0000021,CNC-001,startup,2025-12-29T04:02:49.979Z,OP13,Volutabrum ara auditor tumultus.
LOG0000022,PRESS-002,shutdown,2025-11-15T06:59:12.485Z,OP24,Tibi numquam vergo tantillus tremo appositus ager cupio vitae.
LOG0000023,WELDER-001,alarm,2025-11-22T13:22:39.874Z,OP27,Tredecim animi aeger curiositas.
LOG0000024,CNC-001,shutdown,2025-10-28T12:22:52.043Z,OP17,Decor coniecto deleo.
LOG0000025,WELDER-001,maintenance,2026-01-05T12:37:47.377Z,OP6,Vesco vindico constans cenaculum altus.
LOG0000026,WELDER-001,maintenance,2025-11-19T00:58:58.662Z,OP20,Virgo coaegresco verto.
LOG0000027,FURNACE-001,maintenance,2025-10-15T14:26:03.484Z,OP20,Deprecator versus spes trepide depopulo utrimque abstergo volva.
LOG0000028,PRESS-002,alarm,2025-10-15T06:40:23.714Z,OP5,Adduco aegrus depulso apparatus tenus cognomen urbanus provident adfero maiores.
LOG0000029,PRESS-002,shutdown,2025-11-08T15:34:56.701Z,OP8,Ullus cresco absorbeo aequitas tricesimus.
LOG0000030,CNC-001,shutdown,2026-01-04T02:42:47.236Z,OP27,Corrumpo consuasor acceptus.
LOG0000031,WELDER-001,alarm,2025-10-02T06:07:11.204Z,OP13,Abundans adsidue turba denuncio maiores vos agnosco cilicium teres deputo.
LOG0000032,FURNACE-001,maintenance,2025-11-14T13:23:50.480Z,OP27,Cicuta angustus truculenter vaco omnis celebrer vito terminatio temeritas.
LOG0000033,PRESS-002,alarm,2026-01-02T22:26:58.923Z,OP24,Carbo inventore adduco cursim administratio angustus utilis aeger.
LOG0000034,CNC-002,maintenance,2025-12-27T12:29:03.756Z,OP26,Ambitus ceno hic acsi testimonium armarium porro peccatus solum.
LOG0000035,FURNACE-001,maintenance,2025-12-31T04:42:03.584Z,OP17,Tardus terreo commodi xiphias comminor conventus reiciendis conturbo.
LOG0000036,CNC-001,alarm,2025-11-05T20:12:48.547Z,OP4,Utroque sto via tero copiose corrumpo summa combibo solitudo suffragium.
LOG0000037,PRESS-001,shutdown,2025-10-12T02:31:45.712Z,OP7,Defleo absorbeo thorax.
LOG0000038,CNC-002,alarm,2026-01-08T21:05:19.224Z,OP23,Victoria vulgus textor truculenter tepidus tantillus.
LOG0000039,CNC-001,alarm,2025-11-24T07:49:07.993Z,OP22,Cruentus carbo blanditiis commodo deleo.
LOG0000040,WELDER-001,startup,2025-12-15T23:30:51.642Z,OP8,Ubi tenus contabesco umerus.
LOG0000041,CNC-002,shutdown,2026-01-20T00:37:17.584Z,OP29,Cupiditas templum acsi neque ipsam expedita cubicularis porro pel.
LOG0000042,FURNACE-001,maintenance,2025-10-24T12:02:41.709Z,OP16,Aliquam laborum comparo templum creber fugit solvo suus tabernus.
LOG0000043,WELDER-001,alarm,2025-10-14T21:10:58.701Z,OP27,Mollitia vapulus arca vulgo inflammatio voveo sublime.
LOG0000044,CNC-002,maintenance,2025-10-26T08:41:38.972Z,OP22,Verbum adhuc voluptas comprehendo adflicto venio.
LOG0000045,PRESS-002,shutdown,2025-12-08T06:53:07.526Z,OP20,Vilitas coruscus necessitatibus tondeo quae volubilis carus audeo ante.
LOG0000046,CNC-001,startup,2026-01-27T05:42:20.944Z,OP26,Asporto condico adeo synagoga aveho verbera apud vomer accendo aedificium.
LOG0000047,PRESS-001,alarm,2026-02-11T17:03:23.839Z,OP12,Conqueror viscus peccatus.
LOG0000048,PRESS-001,alarm,2026-02-14T14:06:33.190Z,OP24,Timor debeo acquiro caput.
LOG0000049,WELDER-001,production,2025-11-09T03:48:07.832Z,OP7,Calco et ait caelestis adeo cernuus tabernus tero adsidue usitas.
LOG0000050,PRESS-001,startup,2025-12-09T03:55:16.008Z,OP18,Inventore dolor tui.
LOG0000051,WELDER-001,startup,2025-12-29T21:07:04.582Z,OP5,Totam totam assentator pauper vestrum animi cimentarius tui virgo.
LOG0000052,PRESS-001,startup,2025-12-03T07:50:58.169Z,OP21,Crapula claudeo tergiversatio terreo succedo.
LOG0000053,WELDER-001,maintenance,2025-10-03T15:33:59.266Z,OP22,Ceno temporibus dolore sub deserunt urbs admoneo vestrum cursim.
LOG0000054,WELDER-001,shutdown,2025-12-30T20:47:16.056Z,OP16,Cattus facere velum magnam adflicto speculum ulterius cerno pauci.
LOG0000055,PRESS-001,production,2025-10-19T00:19:33.537Z,OP10,Ambulo tantum argumentum deprecator baiulus.
LOG0000056,PRESS-001,maintenance,2025-10-23T03:40:59.545Z,OP24,Sordeo vinitor attero ad color vulnero solvo a thalassinus.
LOG0000057,PRESS-001,maintenance,2026-01-26T22:31:19.501Z,OP27,Amet depereo clementia nulla coepi consequuntur.
LOG0000058,PRESS-002,startup,2025-12-11T10:15:52.255Z,OP28,Nihil thalassinus alveus.
LOG0000059,WELDER-001,maintenance,2026-01-08T07:34:44.272Z,OP13,Antiquus texo cohaero tempore ante turbo.
LOG0000060,PRESS-001,shutdown,2026-02-12T18:10:00.951Z,OP4,Stultus atavus considero crustulum stips viduo perferendis.
LOG0000061,CNC-002,production,2025-10-05T21:06:51.403Z,OP30,Agnosco nostrum modi articulus accedo talis abstergo vespillo adfero.
LOG0000062,WELDER-001,production,2026-02-13T22:32:30.538Z,OP5,Thesis patria crastinus confugo delectatio calco volutabrum.
LOG0000063,CNC-001,maintenance,2025-10-21T15:51:06.669Z,OP22,Cubicularis amplexus vox ultio aspernatur.
LOG0000064,CNC-002,production,2026-01-26T21:57:37.722Z,OP21,Admoneo sed alias.
LOG0000065,WELDER-001,shutdown,2026-02-10T14:36:28.139Z,OP6,Suffragium sit maiores aro beatus canto via conservo.
LOG0000066,FURNACE-001,alarm,2025-10-26T06:54:04.663Z,OP3,Placeat doloribus textus iure similique benigne temporibus quisquam voro crudelis.
LOG0000067,FURNACE-001,alarm,2025-11-30T09:21:02.311Z,OP10,Deserunt contego adulescens desipio asper antepono altus.
LOG0000068,CNC-002,shutdown,2025-10-03T19:33:27.211Z,OP20,Aranea demitto consequatur ait doloribus cohaero vulticulus quo.
LOG0000069,PRESS-001,maintenance,2026-01-09T11:07:26.168Z,OP28,Deleo catena carcer.
LOG0000070,CNC-001,alarm,2025-10-24T19:22:27.281Z,OP6,Vobis attonbitus coerceo animi temptatio careo culpa.
LOG0000071,CNC-002,startup,2026-01-04T22:12:34.961Z,OP18,Subiungo causa urbanus depono ducimus teres.
LOG0000072,CNC-002,shutdown,2025-10-27T15:14:31.872Z,OP22,Molestias ubi antiquus torrens vilis conscendo.
LOG0000073,CNC-002,startup,2026-01-30T13:06:14.198Z,OP21,Crudelis conventus ex varietas dolore.
LOG0000074,CNC-002,startup,2026-01-21T03:49:04.954Z,OP21,Aestas coerceo vulnus vulgus decumbo conculco delectus.
LOG0000075,CNC-002,shutdown,2026-01-29T04:06:43.367Z,OP18,Consuasor culpa verto.
LOG0000076,CNC-002,shutdown,2025-10-06T15:16:04.399Z,OP9,Subvenio dolorem exercitationem suggero ventito cohors venustas.
LOG0000077,PRESS-001,shutdown,2025-10-12T02:05:14.054Z,OP22,Sodalitas vulgaris teneo vorago.
LOG0000078,PRESS-001,alarm,2026-01-07T13:58:03.770Z,OP18,Amissio virga alo eaque curis error dedico.
LOG0000079,WELDER-001,maintenance,2026-02-14T19:00:30.653Z,OP28,Vulgaris contabesco varius ascit autus adfectus nobis succurro accusator aegre.
LOG0000080,CNC-002,startup,2026-01-02T09:10:44.668Z,OP23,Ambulo cuius balbus crudelis usitas.
LOG0000081,FURNACE-001,shutdown,2026-02-03T22:02:31.205Z,OP24,Vesica valde delinquo attero ver custodia infit quam comitatus cribro.
LOG0000082,CNC-002,maintenance,2025-11-14T17:35:34.727Z,OP2,Aer aeneus utique.
LOG0000083,FURNACE-001,startup,2025-12-15T09:01:27.535Z,OP28,Ara sortitus tempus virgo suscipit temptatio.
LOG0000084,PRESS-001,startup,2025-11-17T08:13:32.301Z,OP15,Arbustum tergo umbra eligendi crur.
LOG0000085,PRESS-002,production,2026-01-27T10:40:53.590Z,OP28,Denego adipiscor casus desparatus.
LOG0000086,CNC-002,startup,2025-10-28T21:59:33.503Z,OP27,Caput umerus at civitas pectus tertius officiis caste atque ager.
LOG0000087,FURNACE-001,alarm,2026-01-02T06:54:36.577Z,OP20,Video vester suppellex candidus venustas degenero aperio.
LOG0000088,CNC-002,shutdown,2025-12-27T13:21:49.961Z,OP6,Caries itaque excepturi decimus combibo calamitas.
LOG0000089,CNC-001,shutdown,2025-11-23T21:43:35.567Z,OP2,Correptius villa articulus agnosco solus bibo minima vox.
LOG0000090,PRESS-001,maintenance,2025-11-10T10:48:28.382Z,OP26,Conitor dignissimos anser reprehenderit cattus celer nemo aegrus.
LOG0000091,PRESS-002,production,2026-01-26T00:05:54.550Z,OP19,Corrigo sol ago blandior statua charisma depono audio.
LOG0000092,PRESS-001,production,2025-11-03T18:50:39.468Z,OP1,Infit amissio corrupti ustilo aequitas casso nisi taedium.
LOG0000093,PRESS-001,maintenance,2026-02-10T11:26:40.941Z,OP16,Decerno ater cogo pecus vulariter carcer trado odit absconditus candidus.
LOG0000094,WELDER-001,maintenance,2025-10-26T00:34:51.209Z,OP18,Uxor sublime vere vigor modi sustineo.
LOG0000095,PRESS-001,shutdown,2025-12-09T08:21:01.133Z,OP9,Nihil dolorem tenax tutis curriculum.
LOG0000096,PRESS-001,maintenance,2025-12-06T11:35:56.851Z,OP5,Coniuratio aperte angelus culpa depopulo cresco.
LOG0000097,CNC-001,shutdown,2026-01-27T03:23:54.878Z,OP4,Trado pauci sed.
LOG0000098,FURNACE-001,alarm,2025-10-08T16:45:15.151Z,OP18,Suffragium spiritus verecundia varius taedium capitulus vorax adfectus aer.
LOG0000099,CNC-001,startup,2025-10-29T16:29:06.037Z,OP20,Amaritudo amoveo audax sulum tubineus desolo aspernatur anser repellendus.
LOG0000100,CNC-002,maintenance,2026-01-11T21:37:05.438Z,OP18,Solvo consectetur deinde tergeo sponte pel.
LOG0000101,PRESS-001,alarm,2026-01-26T05:49:09.235Z,OP24,Dolorem attonbitus antepono curis soleo adamo benevolentia.
LOG0000102,FURNACE-001,startup,2025-11-19T16:10:37.446Z,OP29,Vehemens dedico virgo aureus aveho totus textilis ultra.
LOG0000103,PRESS-001,shutdown,2026-01-30T07:14:38.922Z,OP16,Confido autus crur volubilis.
LOG0000104,PRESS-002,shutdown,2025-11-20T21:01:40.521Z,OP18,Curto vulgus tui ultra verto theatrum apto.
LOG0000105,PRESS-001,startup,2025-11-16T04:37:16.379Z,OP6,Desidero cresco centum.
LOG0000106,CNC-002,alarm,2025-11-07T21:14:02.355Z,OP10,Usus trado ullus aqua.
LOG0000107,PRESS-001,production,2026-01-18T21:34:03.237Z,OP17,Adsidue benevolentia spectaculum demoror claustrum aequitas quasi.
LOG0000108,PRESS-002,maintenance,2026-01-26T00:53:18.333Z,OP23,Vomito delicate dolor circumvenio terminatio cauda voluptas officia.
LOG0000109,FURNACE-001,production,2026-02-02T16:33:57.309Z,OP12,Subseco acquiro spiculum valeo circumvenio cunabula.
LOG0000110,WELDER-001,maintenance,2026-01-09T03:14:08.276Z,OP15,Adimpleo textor adhuc.
LOG0000111,FURNACE-001,alarm,2025-11-14T16:58:36.423Z,OP30,Arbustum colo repudiandae speciosus cotidie commodo una derideo.
LOG0000112,PRESS-002,alarm,2026-01-13T11:39:24.505Z,OP17,Pauci cupiditate ustilo quos calculus speciosus doloremque vicinus sum.
LOG0000113,CNC-002,shutdown,2026-02-07T04:35:25.030Z,OP19,Suasoria deporto baiulus audio consectetur angulus voluptate alter.
LOG0000114,PRESS-001,maintenance,2025-11-16T20:54:06.694Z,OP9,Spiculum facere accusator inventore summopere et veritas virga subiungo.
LOG0000115,CNC-002,maintenance,2026-01-12T13:19:56.700Z,OP3,Vigilo conitor sulum spectaculum patria cenaculum claustrum.
LOG0000116,PRESS-001,startup,2026-01-22T10:18:48.341Z,OP16,Approbo iure sodalitas alii substantia considero dedico deinde veniam.
LOG0000117,CNC-001,shutdown,2025-10-27T21:39:17.383Z,OP22,Blanditiis aveho sufficio.
LOG0000118,FURNACE-001,startup,2025-12-13T14:24:15.181Z,OP23,Terreo caecus anser asper damno amoveo pel labore.
LOG0000119,CNC-001,alarm,2025-12-08T03:13:23.294Z,OP9,Vitiosus repellat tonsor deprimo ago modi.
LOG0000120,CNC-002,startup,2026-01-01T16:34:48.464Z,OP6,Viduo decerno suffragium spectaculum conservo cohaero coaegresco consuasor.
LOG0000121,WELDER-001,startup,2026-01-17T00:44:53.499Z,OP16,Tepidus thesis acsi vinitor suscipit adficio omnis suspendo cohibeo.
LOG0000122,FURNACE-001,startup,2026-02-14T16:37:13.485Z,OP9,Verumtamen aegrotatio spero depulso cotidie desino tabgo.
LOG0000123,PRESS-001,production,2026-01-07T19:09:28.848Z,OP17,Urbanus amoveo minus.
LOG0000124,FURNACE-001,alarm,2026-01-06T11:54:54.083Z,OP6,Consequatur canis cuppedia vis bardus voveo dedecor.
LOG0000125,PRESS-002,alarm,2025-11-03T03:09:38.187Z,OP17,Considero officia decipio territo delego sollers condico deinde.
LOG0000126,WELDER-001,alarm,2026-01-22T10:55:42.431Z,OP5,Degero laudantium adsidue conforto quod demo.
LOG0000127,PRESS-002,production,2025-12-01T05:27:24.689Z,OP15,Anser socius cohaero debitis soleo conduco concido.
LOG0000128,FURNACE-001,startup,2025-12-08T04:21:14.305Z,OP17,Calco explicabo suppono crastinus tamen.
LOG0000129,PRESS-002,maintenance,2025-10-30T15:40:44.354Z,OP9,Vicissitudo vaco dolore sollicito ter tener dedico.
LOG0000130,PRESS-002,maintenance,2025-10-18T01:08:20.787Z,OP7,Suscipit quam assentator pecto deprimo audio suasoria.
LOG0000131,PRESS-002,startup,2025-10-11T15:31:01.301Z,OP3,Tutamen cena trans harum artificiose.
LOG0000132,CNC-001,shutdown,2026-02-08T00:38:53.907Z,OP24,Decor spes modi recusandae tres claro debilito vivo.
LOG0000133,FURNACE-001,production,2026-01-07T00:27:18.567Z,OP13,Undique attollo tamen.
LOG0000134,PRESS-002,startup,2025-11-01T23:33:55.987Z,OP5,Amplitudo adulescens quam ocer adipiscor urbanus depulso templum voco.
LOG0000135,PRESS-001,production,2025-12-18T10:10:30.071Z,OP10,Commodo calculus advenio aegrus compono conor advoco solvo quasi suffoco.
LOG0000136,PRESS-001,alarm,2025-12-27T14:55:00.308Z,OP25,Attero tendo calcar alioqui.
LOG0000137,CNC-002,maintenance,2025-11-04T11:48:02.849Z,OP23,Voluptate tenetur bestia attollo aurum despecto suffragium amoveo alias vulticulus.
LOG0000138,PRESS-002,maintenance,2026-02-12T13:50:38.858Z,OP20,Molestiae toties decerno desipio sursum.
LOG0000139,PRESS-002,maintenance,2025-11-03T08:17:05.381Z,OP27,Vergo tersus voluptas defetiscor coniuratio pecco venio.
LOG0000140,PRESS-002,alarm,2025-12-23T17:13:16.146Z,OP19,Timor acceptus uxor depraedor soleo sunt canis aut assumenda voluptates.
LOG0000141,PRESS-002,production,2025-10-14T23:56:05.347Z,OP23,Aegre desino comparo cilicium.
LOG0000142,CNC-001,shutdown,2025-12-03T14:49:58.434Z,OP13,Teres suscipit illum decipio spiritus velociter cauda carcer.
LOG0000143,PRESS-002,production,2026-01-04T20:44:42.873Z,OP21,Cubo cui apparatus delego arguo.
LOG0000144,PRESS-001,startup,2025-11-19T01:44:34.358Z,OP28,Constans tactus vespillo antepono.
LOG0000145,PRESS-002,startup,2026-01-11T03:04:51.431Z,OP23,Curiositas antea dedecor tibi.
LOG0000146,FURNACE-001,production,2025-10-14T20:37:25.119Z,OP19,Careo sublime nostrum.
LOG0000147,CNC-001,shutdown,2025-10-27T21:42:13.000Z,OP7,Cuius curriculum defungo.
LOG0000148,FURNACE-001,shutdown,2025-12-29T16:29:21.572Z,OP9,Validus curis sumo stipes bardus.
LOG0000149,WELDER-001,maintenance,2025-11-03T03:02:24.226Z,OP16,Administratio caelum ubi amet statim tabella.
LOG0000150,PRESS-001,maintenance,2025-10-31T16:22:05.970Z,OP14,Sponte aedificium delicate cena thorax audacia.
LOG0000151,CNC-001,alarm,2026-02-03T11:40:20.581Z,OP20,Valetudo utrum absorbeo temporibus corpus appello vulgivagus vester antea aer.
LOG0000152,WELDER-001,alarm,2025-12-07T12:49:53.403Z,OP3,Amiculum uredo neque alter.
LOG0000153,CNC-002,maintenance,2025-12-08T19:58:25.237Z,OP3,Uxor alter corrumpo supellex iure.
LOG0000154,CNC-001,shutdown,2026-01-27T22:17:56.019Z,OP7,Audax culpo amplitudo.
LOG0000155,FURNACE-001,maintenance,2025-11-21T23:18:42.257Z,OP24,Cernuus quas vorax subiungo vel supra ulterius vitium.
LOG0000156,WELDER-001,production,2025-12-02T00:52:58.333Z,OP26,Titulus demum defero.
LOG0000157,CNC-001,alarm,2025-10-27T15:53:22.169Z,OP12,Complectus derideo officiis atqui adicio decretum urbs vapulus celo.
LOG0000158,PRESS-002,production,2026-01-30T03:02:21.433Z,OP1,Excepturi vulticulus verus una avaritia suppono.
LOG0000159,PRESS-002,shutdown,2025-11-14T21:15:42.798Z,OP12,Vulticulus conventus xiphias.
LOG0000160,PRESS-002,production,2025-11-12T20:02:29.912Z,OP24,Censura odio sollicito uredo agnitio ager debeo tabella provident defleo.
LOG0000161,CNC-001,maintenance,2026-01-21T06:24:20.478Z,OP19,Curtus campana damno admitto assentator subvenio sonitus.
LOG0000162,FURNACE-001,startup,2026-01-02T03:55:11.498Z,OP25,Deripio adsum pariatur subito cohaero.
LOG0000163,PRESS-001,alarm,2025-12-20T21:14:43.050Z,OP5,Corona decens coepi.
LOG0000164,WELDER-001,maintenance,2025-10-03T14:01:49.912Z,OP25,Coniecto velociter arma aestus possimus.
LOG0000165,WELDER-001,production,2025-12-29T13:53:25.784Z,OP15,Valeo nobis aestivus.
LOG0000166,PRESS-002,alarm,2025-12-06T11:17:30.649Z,OP27,Animadverto demergo pauci deficio tametsi benigne.
LOG0000167,CNC-002,maintenance,2026-02-01T23:31:16.447Z,OP9,Aliqua articulus approbo quisquam.
LOG0000168,CNC-002,alarm,2026-01-16T19:35:31.354Z,OP26,Angustus sui administratio decipio concedo tardus.
LOG0000169,WELDER-001,alarm,2025-11-12T18:53:13.643Z,OP28,Deporto vinco vita communis vilicus tenax tondeo corrigo spoliatio.
LOG0000170,FURNACE-001,shutdown,2026-01-05T10:25:19.324Z,OP19,Amplexus defetiscor suggero attollo theatrum.
LOG0000171,CNC-002,alarm,2025-11-13T02:33:56.649Z,OP12,Depopulo bos universe.
LOG0000172,WELDER-001,alarm,2025-12-29T04:42:17.749Z,OP18,Nesciunt sumo magnam animadverto officia universe utroque eveniet cuius totus.
LOG0000173,CNC-001,production,2025-10-22T08:59:25.117Z,OP7,Celo coerceo succurro culpo dolore dedecor.
LOG0000174,PRESS-002,maintenance,2025-12-27T17:55:16.187Z,OP9,Eos strues numquam cuppedia acceptus.
LOG0000175,WELDER-001,shutdown,2026-01-15T23:08:59.030Z,OP28,Quae spiculum thesaurus adamo deprecator quidem asperiores audax caste.
LOG0000176,CNC-002,maintenance,2026-02-09T21:02:33.788Z,OP6,Sodalitas absque ipsa cupiditate vix bene.
LOG0000177,CNC-001,production,2025-11-23T02:47:49.879Z,OP6,Comes deleniti ceno.
LOG0000178,WELDER-001,production,2025-12-05T00:04:01.893Z,OP5,Eius arma ver turbo brevis comminor speculum virtus sufficio.
LOG0000179,PRESS-002,startup,2025-11-04T18:53:17.452Z,OP4,Aufero vindico copiose amiculum trado commemoro.
LOG0000180,CNC-001,alarm,2025-10-10T05:42:42.935Z,OP11,Utpote utor voluntarius stipes.
LOG0000181,PRESS-001,maintenance,2026-01-18T18:52:47.268Z,OP2,Cumque adaugeo voco tum credo asper curvo.
LOG0000182,FURNACE-001,maintenance,2025-11-07T05:48:58.857Z,OP15,Summa virga abundans velit absens varius canonicus vomer conatus.
LOG0000183,CNC-001,shutdown,2025-12-17T21:22:55.981Z,OP15,Vetus harum utroque sortitus creta labore tribuo cattus caste appono.
LOG0000184,WELDER-001,production,2026-02-13T01:01:49.086Z,OP1,Suppono possimus congregatio theca voluptatibus varietas argumentum perferendis conscendo venia.
LOG0000185,CNC-002,startup,2025-11-12T20:53:43.701Z,OP21,Cupiditate cernuus derelinquo.
LOG0000186,WELDER-001,maintenance,2025-11-18T00:20:32.734Z,OP28,Ademptio ventus eos astrum aqua caput acervus.
LOG0000187,PRESS-002,shutdown,2026-01-07T19:41:52.065Z,OP29,Subiungo summopere super.
LOG0000188,PRESS-001,startup,2026-02-13T16:57:21.658Z,OP13,Laborum aspernatur aliquid traho admoneo vulnus aestas.
LOG0000189,FURNACE-001,shutdown,2025-10-28T02:37:42.761Z,OP9,Baiulus callide cognomen tres sodalitas eos ager copia.
LOG0000190,PRESS-002,production,2025-12-11T07:26:38.083Z,OP20,Decumbo decretum acervus curtus adsum agnosco concedo amitto sui sequi.
LOG0000191,CNC-002,production,2025-11-18T00:22:11.466Z,OP22,Tempus usque via atrocitas decerno.
LOG0000192,CNC-002,startup,2026-02-04T01:24:55.445Z,OP20,Curis derideo certus ager deficio tergum.
LOG0000193,CNC-002,shutdown,2025-11-03T18:39:09.280Z,OP27,Conitor defero tendo quibusdam audio theatrum tutis.
LOG0000194,PRESS-001,production,2025-11-09T12:47:52.006Z,OP12,Desolo adulescens depono pecco contego arto.
LOG0000195,PRESS-001,alarm,2025-12-16T17:20:54.874Z,OP5,Venustas patrocinor veritas.
LOG0000196,PRESS-002,shutdown,2025-10-18T23:21:48.544Z,OP11,Atavus accommodo eligendi cum caput tenuis xiphias vitae.
LOG0000197,PRESS-001,startup,2026-01-13T20:10:53.934Z,OP15,Vaco acsi decipio sophismata quo crudelis adsidue animi.
LOG0000198,WELDER-001,maintenance,2025-10-30T23:46:19.320Z,OP20,Celo universe aegrotatio crur defleo.
LOG0000199,PRESS-002,maintenance,2025-12-06T04:05:06.439Z,OP6,Claudeo auctus tamen canis turbo victoria super demitto cupio cras.
LOG0000200,FURNACE-001,production,2025-11-27T03:41:53.865Z,OP17,Callide aqua barba atrox pauper appono corrigo.
LOG0000201,WELDER-001,startup,2025-12-05T14:31:43.526Z,OP16,Studio defaeco fugit tamen veniam contabesco.
LOG0000202,CNC-002,production,2025-11-27T17:19:57.919Z,OP1,Mollitia cupressus defaeco thermae damnatio.
LOG0000203,WELDER-001,production,2025-12-02T03:14:16.801Z,OP28,Viduo temptatio sol patruus complectus facere somnus.
LOG0000204,PRESS-001,maintenance,2025-11-01T23:40:10.832Z,OP25,Cervus aurum uredo approbo adficio vesper temeritas.
LOG0000205,CNC-001,alarm,2026-02-13T22:41:19.183Z,OP20,Sodalitas demitto curo conventus amiculum adaugeo depulso aut cupiditate.
LOG0000206,PRESS-001,shutdown,2025-12-31T02:26:11.610Z,OP29,Deinde rerum voluptatibus vaco molestiae vinum antepono totus a carbo.
LOG0000207,PRESS-001,startup,2025-12-04T09:45:33.038Z,OP2,Dicta truculenter virgo tenax umquam.
LOG0000208,WELDER-001,production,2025-12-08T08:17:43.651Z,OP2,Pax facilis creo annus allatus una sublime stips celer voluptatem.
LOG0000209,FURNACE-001,production,2025-10-15T14:38:17.453Z,OP20,Depereo contra aequus labore vaco damno totam rerum aestus.
LOG0000210,CNC-002,maintenance,2026-01-21T22:42:17.709Z,OP8,Validus copia vicissitudo voluptatum voveo demum.
LOG0000211,CNC-001,shutdown,2026-01-10T21:13:29.011Z,OP26,Cicuta vilitas bellum cresco carcer admoveo cunabula.
LOG0000212,CNC-002,startup,2026-01-20T00:53:00.848Z,OP1,Auditor cernuus despecto balbus.
LOG0000213,FURNACE-001,shutdown,2025-11-19T12:07:00.169Z,OP20,Adsuesco tres ultra acidus.
LOG0000214,FURNACE-001,maintenance,2026-02-07T01:33:30.514Z,OP22,Torqueo cado arca carus modi consuasor accedo patruus.
LOG0000215,CNC-002,production,2026-02-05T08:56:07.033Z,OP22,Absens atqui at voro ancilla theatrum sperno ascit admoveo provident.
LOG0000216,CNC-001,startup,2025-11-26T22:19:21.643Z,OP6,Beatae volubilis enim verecundia auditor cicuta delicate verbera.
LOG0000217,PRESS-002,production,2025-11-29T18:25:19.256Z,OP24,Usitas subito abutor adnuo conservo debeo maiores vomer pecto.
LOG0000218,PRESS-001,shutdown,2026-02-07T07:00:40.523Z,OP12,Unde animus ultio cogo caries.
LOG0000219,FURNACE-001,maintenance,2026-02-10T19:40:30.769Z,OP26,Ademptio colligo umerus aggero substantia statua capillus.
LOG0000220,CNC-002,alarm,2025-12-26T06:15:05.138Z,OP12,Turpis cum uberrime bos.
LOG0000221,CNC-001,alarm,2026-01-31T23:49:41.607Z,OP4,Antepono tergo illum culpo undique repellat culpo antea victoria versus.
LOG0000222,CNC-001,alarm,2025-12-23T14:29:17.551Z,OP11,Recusandae coepi armarium defluo ullam curtus correptius desolo blanditiis.
LOG0000223,WELDER-001,shutdown,2026-02-01T18:28:00.000Z,OP17,Sophismata occaecati abstergo stella terreo.
LOG0000224,CNC-002,production,2026-01-01T10:13:20.400Z,OP22,Aggero anser xiphias congregatio nulla argentum.
LOG0000225,PRESS-002,production,2025-10-11T18:41:13.842Z,OP28,Demo creo adicio acies esse.
LOG0000226,CNC-001,startup,2026-02-02T00:20:31.388Z,OP14,Amet corroboro absconditus nulla varietas uxor non saepe ater.
LOG0000227,FURNACE-001,maintenance,2025-12-30T01:06:12.094Z,OP9,Abeo accommodo absorbeo unde accusantium verus.
LOG0000228,CNC-001,alarm,2025-10-07T00:17:17.093Z,OP6,Aggero numquam tibi censura talio bellicus.
LOG0000229,CNC-001,maintenance,2025-12-12T20:43:27.730Z,OP27,Stips solum trans campana.
LOG0000230,PRESS-002,production,2026-01-06T16:27:37.067Z,OP11,Supellex defleo victoria.
LOG0000231,WELDER-001,shutdown,2026-01-25T15:17:05.455Z,OP14,Tubineus sint earum casus ustulo reiciendis cilicium utor.
LOG0000232,FURNACE-001,shutdown,2025-12-31T10:04:13.819Z,OP26,Sumptus adipisci adficio certe ver.
LOG0000233,FURNACE-001,maintenance,2025-10-15T11:26:37.759Z,OP8,Sufficio aequitas crepusculum voluptatem accedo non curatio repudiandae defero.
LOG0000234,FURNACE-001,startup,2025-10-27T13:45:46.291Z,OP17,Ad complectus acerbitas uterque nulla bibo tolero vigor.
