log_id,equipment_id,event_type,timestamp,operator_id,message
LOG0000713,FURNACE-001,alarm,2026-01-13T11:17:17.320Z,OP17,Terga quis quod spargo cenaculum venia supplanto cupiditas careo spectaculum.
LOG0000714,PRESS-001,production,2025-11-14T17:18:49.640Z,OP25,Admiratio bestia subvenio decimus depromo vinculum.
LOG0000715,PRESS-001,alarm,2026-01-02T07:37:20.421Z,OP18,Conturbo trado decipio non temeritas video teneo aliqua corroboro voco.
LOG0000716,WELDER-001,startup,2025-10-21T14:35:30.177Z,OP1,Saepe dolor beneficium subiungo tepidus amiculum animi denuncio blanditiis verto.
LOG0000717,WELDER-001,alarm,2026-01-30T02:44:54.132Z,OP1,Animi aureus solium vito rem denuo utpote via careo acquiro.
LOG0000718,WELDER-001,shutdown,2026-02-05T01:33:56.206Z,OP25,Convoco ceno claro conor collum asporto cito at.
LOG0000719,FURNACE-001,shutdown,2025-10-22T05:13:57.797Z,OP24,Caput conduco addo summopere deinde abduco defleo alias in.
LOG0000720,CNC-002,maintenance,2026-01-14T08:23:20.765Z,OP21,Tepidus repellendus sublime deserunt.
LOG0000721,PRESS-001,shutdown,2026-02-01T19:12:44.389Z,OP10,Vigilo custodia adfectus ea animus tot libero caecus officiis.
LOG0000722,WELDER-001,shutdown,2025-12-22T14:16:40.653Z,OP18,Beatae sequi tabgo argentum sodalitas suggero adimpleo.
LOG0000723,CNC-002,production,2025-12-20T01:09:43.334Z,OP22,Vestrum acies ipsa stipes ut defendo tabesco claudeo.
LOG0000724,FURNACE-001,shutdown,2025-12-22T01:51:25.488Z,OP14,Conitor succurro aeternus adinventitias vilis deserunt.
LOG0000725,PRESS-001,maintenance,2025-12-08T15:47:17.224Z,OP2,Dedecor ago vicinus molestias suscipit defluo bos velum curtus.
LOG0000726,PRESS-001,shutdown,2025-11-23T09:32:08.983Z,OP2,Neque dolorem voluptatibus dapifer uterque laboriosam deficio deleo quaerat.
LOG0000727,PRESS-002,alarm,2026-01-20T10:38:08.737Z,OP13,Aiunt tot voluptates coadunatio ut vulticulus decor clamo baiulus.
LOG0000728,PRESS-002,shutdown,2025-11-07T01:27:14.309Z,OP7,Atrox vis quae credo quibusdam subnecto voluptatem aperte terror theca.
LOG0000729,CNC-001,startup,2025-11-10T07:13:37.419Z,OP2,Casso tredecim casso.
LOG0000730,PRESS-002,maintenance,2025-12-02T21:25:01.725Z,OP2,Carpo patrocinor derideo teres trucido toties adipiscor.
LOG0000731,PRESS-001,maintenance,2026-02-04T18:27:12.102Z,OP23,Subiungo a tracto blandior spero.
LOG0000732,PRESS-002,maintenance,2025-12-18T17:09:15.234Z,OP15,Allatus atqui canonicus infit aurum quidem aetas.
LOG0000733,WELDER-001,startup,2026-01-04T08:57:49.236Z,OP24,Talus inventore denego ullam stabilis.
LOG0000734,CNC-002,production,2025-12-18T17:07:02.108Z,OP13,Expedita deficio tondeo tredecim aestus certus crudelis.
LOG0000735,PRESS-002,shutdown,2026-01-16T05:49:52.811Z,OP7,Baiulus vacuus culpa ventito tamen trans subito absens suffoco.
LOG0000736,WELDER-001,shutdown,2026-01-18T15:35:29.882Z,OP2,Umquam amitto argentum.
LOG0000737,CNC-001,shutdown,2025-12-23T07:20:29.440Z,OP12,Officia carpo labore adopto provident tantum vilis.
LOG0000738,CNC-001,shutdown,2026-01-01T03:13:30.415Z,OP21,Summa crur amaritudo copia adfero urbanus spargo canonicus suasoria.
LOG0000739,FURNACE-001,production,2026-01-06T01:00:47.756Z,OP28,Antiquus earum umerus carpo statua vicissitudo conqueror temperantia cohaero.
LOG0000740,PRESS-002,shutdown,2025-12-23T08:42:55.036Z,OP27,Laudantium aliquid cohors cimentarius somnus magni conforto tunc beatae.
LOG0000741,PRESS-001,startup,2026-01-23T08:24:15.075Z,OP20,Conscendo deduco tamen vulgo tergiversatio vere.
LOG0000742,PRESS-001,shutdown,2026-02-02T21:50:52.222Z,OP15,Tempus attollo voluptatibus subito adaugeo advoco suscipio.
LOG0000743,PRESS-002,startup,2026-01-23T09:25:40.654Z,OP5,Eos charisma conscendo paens eligendi.
LOG0000744,PRESS-002,startup,2025-11-24T03:51:21.582Z,OP30,Crur usus angelus volva depopulo casso appositus fuga.
LOG0000745,PRESS-002,alarm,2026-01-28T16:51:07.402Z,OP5,Color caute cohors auxilium fugiat summa supplanto aiunt audio supra.
LOG0000746,PRESS-001,startup,2025-10-01T06:58:46.297Z,OP25,Sublime defero utique venia saepe pauci animi corrupti.
LOG0000747,CNC-001,maintenance,2026-02-14T14:05:39.956Z,OP4,Tergiversatio comprehendo denuncio dolores confugo certe.
LOG0000748,PRESS-001,maintenance,2026-02-12T05:48:25.038Z,OP18,Quasi thesis caelestis absum agnosco custodia incidunt sequi doloribus studio.
LOG0000749,PRESS-001,production,2026-01-28T10:20:00.713Z,OP28,Vindico ultio incidunt sopor.
LOG0000750,CNC-001,maintenance,2025-10-17T10:58:39.157Z,OP12,Averto laboriosam cauda.
LOG0000751,WELDER-001,shutdown,2025-10-30T12:49:58.300Z,OP11,Officiis amoveo tribuo villa aer sit tubineus vero casso nostrum.
LOG0000752,CNC-001,production,2025-11-21T21:38:26.975Z,OP1,Culpo circumvenio venio atavus temptatio utpote curo conventus pel.
LOG0000753,PRESS-001,startup,2025-12-10T17:12:17.980Z,OP27,Tergum eos taceo thalassinus aut.
LOG0000754,PRESS-002,production,2026-01-16T03:07:22.783Z,OP8,Cumque cuppedia cresco supra tum concido dedico.
LOG0000755,PRESS-001,shutdown,2025-11-17T20:43:31.678Z,OP21,Illo aut quo textor terror.
LOG0000756,CNC-001,shutdown,2026-01-17T21:19:13.144Z,OP15,Stipes audio ab spes aggredior crepusculum ustilo ex a territo.
LOG0000757,CNC-002,shutdown,2025-11-26T20:11:48.795Z,OP21,Thesis theologus summopere conculco arbor.
LOG0000758,CNC-001,shutdown,2025-12-13T09:27:24.474Z,OP30,Curis amo auditor debilito.
LOG0000759,FURNACE-001,maintenance,2025-11-20T02:40:53.007Z,OP13,Baiulus custodia caveo impedit vobis iste stultus tenuis victoria.
LOG0000760,CNC-001,alarm,2025-10-20T10:55:18.172Z,OP3,Amplitudo cupiditas arbitro stips coaegresco conqueror ara urbs.
LOG0000761,PRESS-001,production,2025-11-28T02:05:33.058Z,OP22,Vero adflicto causa cicuta.
LOG0000762,PRESS-001,startup,2026-02-07T05:53:25.987Z,OP13,Stipes excepturi degusto speciosus iusto vulnus quas crastinus conicio.
LOG0000763,CNC-001,alarm,2026-02-10T16:43:12.841Z,OP28,Debeo trucido distinctio acquiro solio speculum.
LOG0000764,WELDER-001,production,2025-12-08T21:14:02.412Z,OP5,Coepi tego uter provident dignissimos.
LOG0000765,WELDER-001,production,2025-10-14T14:20:01.110Z,OP8,Verto terror benevolentia ducimus sodalitas catena acidus accusamus patria.
LOG0000766,WELDER-001,maintenance,2025-11-28T21:31:42.955Z,OP8,Correptius conspergo vigilo.
LOG0000767,CNC-002,alarm,2025-10-19T19:43:58.869Z,OP27,Voluptatem unde tempus aeger.
LOG0000768,CNC-002,shutdown,2025-11-20T00:52:08.732Z,OP7,Cura dapifer attonbitus virgo tepidus certus strenuus utrimque.
LOG0000769,WELDER-001,alarm,2026-01-17T17:55:28.253Z,OP19,Curia coadunatio carpo comedo.
LOG0000770,FURNACE-001,shutdown,2025-12-08T00:37:31.014Z,OP12,Suggero coadunatio aequitas.
LOG0000771,CNC-002,alarm,2025-10-20T11:47:52.832Z,OP7,Centum esse terra cito denuo caste.
LOG0000772,PRESS-001,startup,2025-11-12T05:50:30.171Z,OP10,Audacia vigor sonitus approbo.
LOG0000773,FURNACE-001,alarm,2025-11-26T06:51:58.825Z,OP17,Damnatio aduro tantum cubicularis adinventitias stipes.
LOG0000774,CNC-001,maintenance,2026-01-14T06:56:39.376Z,OP8,Tempus cervus bellicus sono voluptatibus cuius sufficio.
LOG0000775,PRESS-001,shutdown,2025-12-15T08:31:12.813Z,OP5,Stips desolo tenax tabula ipsam crapula.
LOG0000776,CNC-001,production,2025-10-11T16:16:40.054Z,OP6,Acquiro attollo magnam tempore cohors volup defleo.
LOG0000777,CNC-002,alarm,2025-10-11T19:06:46.488Z,OP14,Unus vae aegre aestus tergiversatio.
LOG0000778,WELDER-001,alarm,2025-10-30T00:51:02.626Z,OP14,Termes curto consequuntur cibo dapifer tenus defendo celebrer.
LOG0000779,WELDER-001,alarm,2025-11-09T16:34:27.243Z,OP14,Aspicio sonitus tres amplexus adduco admoveo.
LOG0000780,PRESS-001,shutdown,2025-12-19T18:00:32.968Z,OP14,Curiositas civitas triduana thema.
LOG0000781,CNC-002,shutdown,2026-02-01T18:12:35.195Z,OP29,Consuasor virga atavus cubicularis.
LOG0000782,WELDER-001,maintenance,2025-11-14T00:02:48.836Z,OP5,Terebro contego cavus animi contra cohibeo.
LOG0000783,WELDER-001,startup,2025-10-02T18:11:34.183Z,OP27,Illum sit cras damnatio surgo celebrer despecto.
LOG0000784,CNC-001,production,2025-10-18T15:22:06.514Z,OP20,Commemoro caelestis terreo vulariter nemo consequatur cavus.
LOG0000785,PRESS-001,shutdown,2025-10-24T20:35:20.832Z,OP30,Volubilis verbera cornu.
LOG0000786,PRESS-001,alarm,2025-12-07T01:40:47.104Z,OP10,Delicate sono caste textor approbo magni nobis viscus desparatus.
LOG0000787,PRESS-001,production,2025-12-18T06:52:29.886Z,OP27,Totam inflammatio congregatio arx.
LOG0000788,FURNACE-001,startup,2025-10-28T14:36:57.659Z,OP16,Caste cohibeo incidunt suus agnosco comedo paulatim civis deputo tonsor.
LOG0000789,PRESS-001,startup,2026-01-21T08:54:22.479Z,OP6,Soluta dolor caveo dolores.
LOG0000790,PRESS-002,startup,2025-11-14T17:50:09.027Z,OP1,Tempus ascisco careo aestas auctor delego.
LOG0000791,WELDER-001,production,2025-11-16T22:07:49.563Z,OP21,Deleo vere vehemens sodalitas.
LOG0000792,CNC-001,maintenance,2025-12-18T13:33:57.786Z,OP27,Sumo vulgo deripio facere subvenio depono cupressus suus magnam.
LOG0000793,PRESS-001,shutdown,2025-10-02T16:20:55.250Z,OP17,Sursum summisse defetiscor.
LOG0000794,CNC-001,startup,2025-12-11T05:07:46.910Z,OP14,Arto cattus accusantium animi aequus vehemens laudantium arcus.
LOG0000795,PRESS-001,maintenance,2025-11-17T03:18:25.432Z,OP28,Tempore pax conduco surgo claudeo.
LOG0000796,CNC-002,production,2026-02-03T15:17:36.323Z,OP1,Speculum annus quo alius tandem patior.
LOG0000797,CNC-001,alarm,2026-01-19T20:42:38.541Z,OP4,Conicio similique curvo commodo cognomen tamen coniecto templum.
LOG0000798,CNC-001,startup,2025-12-20T15:27:11.572Z,OP14,Minima utique temperantia vilicus.
LOG0000799,WELDER-001,maintenance,2025-12-17T20:18:05.255Z,OP10,Succedo inflammatio cursim admoneo delego pecus cometes talis bonus.
LOG0000800,CNC-002,startup,2025-12-17T07:52:41.547Z,OP20,Decerno supplanto verumtamen id caritas coepi.
LOG0000801,CNC-001,alarm,2026-01-02T03:12:05.732Z,OP21,Demens ipsa amplus tenax ab occaecati.
LOG0000802,PRESS-001,alarm,2026-01-31T17:21:12.532Z,OP18,Tersus tumultus ademptio complectus currus sui desparatus fuga demoror ipsa.
LOG0000803,FURNACE-001,maintenance,2026-01-28T07:48:34.539Z,OP16,Aegrotatio ante damnatio succedo sapiente perferendis provident depulso illo maiores.
LOG0000804,WELDER-001,shutdown,2025-11-16T10:15:42.196Z,OP25,Excepturi barba umquam subito arbor tertius in.
LOG0000805,CNC-001,maintenance,2025-12-28T02:21:06.657Z,OP22,Eaque creator aveho corroboro dens ulciscor usus uter.
LOG0000806,PRESS-001,shutdown,2025-12-07T06:13:51.050Z,OP3,Calculus suus sto vilicus videlicet tubineus audacia atqui.
LOG0000807,PRESS-001,maintenance,2026-01-19T07:50:14.645Z,OP13,Paens tripudio tollo ipsam.
LOG0000808,CNC-001,maintenance,2025-12-13T23:54:42.923Z,OP12,Cupressus curto terra aiunt.
LOG0000809,PRESS-002,startup,2026-02-13T23:23:39.132Z,OP18,Trucido vesica dens ancilla ambulo suffoco patrocinor basium.
LOG0000810,FURNACE-001,maintenance,2026-01-27T13:46:19.240Z,OP24,Caste ante patior votum repudiandae tenetur stella quisquam canonicus.
LOG0000811,CNC-001,startup,2025-10-19T11:58:03.969Z,OP9,Sollers votum necessitatibus vitium.
LOG0000812,PRESS-002,shutdown,2026-01-05T17:08:50.370Z,OP1,Aliqua excepturi cubicularis dedico communis valeo autus acquiro viscus.
LOG0000813,CNC-002,maintenance,2025-10-10T01:15:59.248Z,OP2,Demergo atqui cubitum reiciendis adulatio undique curiositas decretum sursum nostrum.
LOG0000814,CNC-001,shutdown,2025-12-09T03:16:55.888Z,OP5,Denuncio veniam angustus ullam cauda bellicus.
LOG0000815,PRESS-002,production,2025-10-15T07:40:56.042Z,OP24,Adnuo avaritia coaegresco.
LOG0000816,CNC-002,alarm,2026-01-02T01:15:16.348Z,OP28,Ante nihil harum videlicet vesco.
LOG0000817,PRESS-001,maintenance,2026-01-27T03:29:09.954Z,OP29,Desipio curatio quidem conqueror trans carmen toties decretum.
LOG0000818,WELDER-001,alarm,2025-10-01T01:34:16.138Z,OP12,Abundans agnitio absconditus repellendus victoria animi dedico terror caelestis.
LOG0000819,PRESS-001,maintenance,2025-12-12T17:12:30.817Z,OP20,Vulgus coerceo ulterius vulnero deinde cogo.
LOG0000820,PRESS-002,startup,2025-12-05T14:25:30.398Z,OP24,Utor vitiosus auditor.
LOG0000821,WELDER-001,production,2025-12-22T00:18:20.249Z,OP7,Fugit amo corrupti vesper comis dolor.
LOG0000822,PRESS-001,maintenance,2026-01-03T18:28:42.964Z,OP29,Votum casso tabula solutio tredecim sapiente vomer caritas casus sortitus.
LOG0000823,PRESS-001,maintenance,2025-10-13T08:09:43.366Z,OP20,Quasi dolore apud ambulo atrocitas vestrum colo voluptate.
LOG0000824,CNC-001,alarm,2025-10-24T13:07:32.172Z,OP1,Videlicet cimentarius argumentum pecco virtus et comitatus vomito colo.
LOG0000825,CNC-001,alarm,2026-01-20T14:30:35.221Z,OP2,Depraedor acerbitas sit calculus repudiandae defungo capitulus cogo deputo supplanto.
LOG0000826,CNC-002,startup,2025-12-06T17:54:17.469Z,OP26,Crinis amaritudo pariatur.
LOG0000827,CNC-002,shutdown,2026-01-18T08:11:59.874Z,OP19,Debitis abscido depromo via demum catena cruciamentum absorbeo aufero.
LOG0000828,PRESS-002,maintenance,2026-01-12T08:41:17.148Z,OP2,Vel depopulo tutamen antea causa nulla cometes dapifer.
LOG0000829,FURNACE-001,startup,2026-02-06T16:50:40.755Z,OP24,Accusantium cogo debilito denique tristis atrox at necessitatibus.
LOG0000830,CNC-002,shutdown,2025-12-30T19:06:58.944Z,OP19,Custodia apud amplexus varius necessitatibus.
LOG0000831,CNC-001,shutdown,2025-10-10T10:08:02.646Z,OP1,Arcus curso teneo absque commodo velum vomer.
LOG0000832,WELDER-001,startup,2025-12-17T22:04:47.752Z,OP15,Fugit trucido bonus vere delibero antea vir virtus.
LOG0000833,CNC-002,maintenance,2025-12-14T06:33:31.360Z,OP12,Tenax velociter ultra ascit mollitia sophismata viriliter tracto perferendis.
LOG0000834,CNC-002,startup,2025-10-03T09:31:09.893Z,OP29,Aurum aeternus apud.
LOG0000835,FURNACE-001,shutdown,2025-12-14T10:14:06.749Z,OP3,Templum velum tertius commodi cervus venia accusamus conitor.
LOG0000836,PRESS-002,maintenance,2025-10-18T07:06:44.488Z,OP26,Convoco textor eligendi nostrum defaeco complectus aestus triumphus tabgo aufero.
LOG0000837,FURNACE-001,startup,2025-10-31T01:02:46.273Z,OP13,Timidus aspernatur ago.
LOG0000838,CNC-001,shutdown,2025-12-27T21:37:24.462Z,OP25,Coniuratio saepe accendo centum.
LOG0000839,WELDER-001,alarm,2025-10-25T23:06:33.818Z,OP28,Verumtamen thalassinus crinis voro cohors quo cura.
LOG0000840,PRESS-002,production,2025-11-03T20:21:14.901Z,OP28,Damno vetus quasi consequatur.
LOG0000841,PRESS-001,startup,2025-12-29T14:28:00.756Z,OP26,Apostolus minima theologus voco.
LOG0000842,PRESS-001,maintenance,2026-02-11T01:05:38.596Z,OP12,Taceo amiculum aqua cognomen corroboro sint cauda.
LOG0000843,PRESS-002,shutdown,2025-10-29T09:29:36.337Z,OP4,Somnus administratio creptio laborum vilitas.
LOG0000844,CNC-001,maintenance,2025-12-10T15:56:18.093Z,OP8,Expedita circumvenio desidero pauci iusto.
LOG0000845,FURNACE-001,shutdown,2026-01-01T06:33:51.393Z,OP1,Adicio tantillus talus considero blanditiis cinis taceo cariosus.
LOG0000846,WELDER-001,shutdown,2026-01-06T11:07:33.166Z,OP29,Strenuus eius arceo accendo curriculum similique spes tenus aufero.
LOG0000847,CNC-001,maintenance,2025-11-26T17:20:10.173Z,OP2,Deduco solium sapiente templum alius.
LOG0000848,CNC-001,alarm,2026-01-18T06:48:48.546Z,OP21,Voluptas solus vesica chirographum averto civis.
LOG0000849,WELDER-001,production,2025-11-09T07:35:37.847Z,OP20,Teres capto vacuus.
LOG0000850,FURNACE-001,shutdown,2025-10-04T23:49:13.238Z,OP11,Delicate accusamus cura quia ante videlicet patruus anser.
LOG0000851,FURNACE-001,shutdown,2026-01-20T01:29:43.328Z,OP2,Curvo corrumpo altus cultellus sui vestigium.
LOG0000852,FURNACE-001,startup,2026-02-10T17:22:19.108Z,OP20,Absum tactus curo vix adinventitias pel amiculum.
LOG0000853,FURNACE-001,startup,2026-01-25T01:40:27.972Z,OP25,Terra cultellus ut canonicus tribuo consequuntur nemo totus praesentium.
LOG0000854,WELDER-001,maintenance,2025-10-06T02:48:49.389Z,OP15,Textilis cotidie suffoco cilicium uter.
LOG0000855,FURNACE-001,alarm,2026-01-03T13:48:16.198Z,OP3,Solium vallum terebro xiphias arbustum.
LOG0000856,CNC-001,shutdown,2025-10-06T01:41:26.044Z,OP20,Confugo aqua tredecim assentator provident sed adsum solitudo.
LOG0000857,PRESS-002,maintenance,2025-10-30T03:20:47.342Z,OP16,Clibanus armarium adipisci.
LOG0000858,PRESS-001,startup,2025-10-31T06:08:36.292Z,OP30,Coadunatio defendo patruus sit una appono sui accusamus tempus cumque.
LOG0000859,FURNACE-001,maintenance,2026-02-01T06:05:29.121Z,OP25,Adamo vereor sollers verto molestiae appono.
LOG0000860,PRESS-002,production,2025-10-09T10:31:38.288Z,OP30,Repudiandae deorsum quaerat vaco.
LOG0000861,WELDER-001,production,2025-11-17T13:24:25.289Z,OP18,Excepturi paulatim attero.
LOG0000862,CNC-001,shutdown,2026-02-02T05:48:16.401Z,OP22,Sustineo tergiversatio suffragium atqui thymbra cognomen stella victus cito viriliter.
LOG0000863,PRESS-001,maintenance,2026-01-31T11:43:13.494Z,OP14,Cognomen cultellus armarium cura.
LOG0000864,PRESS-001,maintenance,2026-01-16T07:49:48.995Z,OP13,Suffragium coniuratio amitto tamdiu consequuntur.
LOG0000865,PRESS-001,production,2025-12-25T14:06:12.492Z,OP12,Talis dedecor undique aliquid utor arca charisma veniam venio.
LOG0000866,PRESS-002,production,2026-01-30T01:37:30.457Z,OP10,Dolor umbra in adopto tristis chirographum desolo admoneo neque defungo.
LOG0000867,CNC-002,alarm,2025-10-02T10:53:20.253Z,OP14,Usitas balbus usitas spargo coniecto laboriosam deripio.
LOG0000868,PRESS-001,alarm,2025-11-02T22:23:20.921Z,OP2,Spes vehemens thesaurus.
LOG0000869,FURNACE-001,maintenance,2025-10-13T07:05:09.897Z,OP24,Decerno arceo urbanus suppellex capio adficio usque sumptus.
LOG0000870,PRESS-001,maintenance,2025-10-10T23:17:23.267Z,OP16,Umquam abstergo saepe caste peccatus beatus virtus eligendi comes.
LOG0000871,FURNACE-001,alarm,2025-12-30T21:25:25.948Z,OP20,Aegrotatio calculus solitudo accusamus defaeco vallum tepidus.
LOG0000872,WELDER-001,alarm,2026-01-11T03:37:43.643Z,OP27,Autus incidunt vacuus articulus decor tot.
LOG0000873,PRESS-001,shutdown,2026-01-29T22:37:06.603Z,OP21,Confido rerum cubitum bonus solvo voco admoveo aestivus.
LOG0000874,WELDER-001,startup,2025-12-08T02:31:58.930Z,OP20,Totidem tubineus utrimque deputo attollo cupio.
LOG0000875,CNC-002,startup,2025-10-04T06:31:44.603Z,OP23,Aggero subnecto viduo bonus decumbo xiphias adamo adamo cunae repellendus.
LOG0000876,CNC-002,startup,2025-10-22T21:42:20.496Z,OP8,Unde victoria ascisco curtus coerceo vaco tripudio validus vigilo utrimque.
LOG0000877,FURNACE-001,alarm,2026-02-07T10:43:01.945Z,OP21,Valeo studio tenax armarium copiose verbera.
LOG0000878,CNC-001,production,2026-02-05T21:03:56.346Z,OP20,Vergo admiratio sordeo cibus verumtamen cognatus laboriosam ex.
LOG0000879,FURNACE-001,shutdown,2026-02-01T18:18:43.127Z,OP14,Territo adsum tunc arma subvenio thorax clam.
LOG0000880,PRESS-001,startup,2025-10-22T10:53:19.304Z,OP6,Torqueo alo vox praesentium celo vereor vulnus aveho eveniet.
LOG0000881,WELDER-001,alarm,2026-01-26T17:28:15.568Z,OP23,Cruentus adimpleo demonstro tenus aestus possimus paulatim vesper.
LOG0000882,PRESS-002,alarm,2025-12-04T06:04:21.168Z,OP23,Accusamus defleo exercitationem custodia deinde autus colligo blandior cupio thorax.
LOG0000883,CNC-001,maintenance,2025-10-02T03:49:06.394Z,OP18,Debilito terror bene conitor ciminatio nostrum sollicito abundans sit vis.
LOG0000884,PRESS-001,alarm,2026-01-30T13:35:39.734Z,OP26,Tergeo tergiversatio animus texo caecus comburo velum ascit.
LOG0000885,FURNACE-001,maintenance,2025-12-23T15:50:40.714Z,OP14,Iusto ut amet cohaero omnis alias.
LOG0000886,CNC-001,alarm,2026-02-13T04:34:14.253Z,OP29,Cubicularis eligendi peccatus cupressus desipio valetudo adamo.
LOG0000887,WELDER-001,startup,2025-10-18T02:58:28.982Z,OP21,Antepono caput verus pel ulterius tamisium vorago copiose conicio tamisium.
LOG0000888,FURNACE-001,production,2026-02-08T06:45:49.290Z,OP7,Ultra deinde animus laboriosam adipisci.
LOG0000889,CNC-001,maintenance,2025-12-09T11:00:47.963Z,OP16,Aspicio ante correptius cur thema cinis tibi caveo tibi.
LOG0000890,CNC-002,production,2025-11-06T03:30:32.399Z,OP11,Toties accendo abeo victoria ventus compono cubitum una certus solvo.
LOG0000891,CNC-002,startup,2025-12-17T02:04:16.362Z,OP26,Curiositas cohibeo vos.
LOG0000892,CNC-001,alarm,2025-11-14T11:00:36.616Z,OP27,Vicinus talis comprehendo corrumpo templum viscus acies velociter libero cimentarius.
LOG0000893,PRESS-001,production,2026-01-18T11:27:49.296Z,OP14,Conqueror conitor rerum corpus defero impedit vilis tabella totam.
LOG0000894,PRESS-002,production,2025-10-27T18:56:04.019Z,OP16,Culpo spiculum suspendo pel ubi aufero tantillus ubi basium.
LOG0000895,FURNACE-001,production,2026-01-28T02:44:44.452Z,OP13,Aliquid defleo stipes ceno eius demonstro vestigium solitudo arca degenero.
LOG0000896,CNC-002,alarm,2025-10-17T13:11:22.759Z,OP12,Vulgivagus similique virga administratio voluptatum.
LOG0000897,CNC-001,production,2025-10-30T19:59:14.320Z,OP6,Solitudo officia audio strenuus advoco aer triumphus trado.
LOG0000898,PRESS-002,alarm,2025-12-16T10:25:13.345Z,OP12,Asporto accommodo curis aspicio canis coaegresco.
LOG0000899,CNC-001,production,2026-02-09T14:42:39.433Z,OP11,Cibo tabernus terror.
LOG0000900,FURNACE-001,production,2025-12-24T13:56:16.368Z,OP29,Caterva verto nesciunt volubilis centum usque conduco ulterius.
LOG0000901,CNC-002,startup,2026-01-20T07:05:00.951Z,OP4,Compono consequuntur suspendo cauda congregatio.
LOG0000902,WELDER-001,startup,2025-11-27T09:35:37.662Z,OP3,Eum statim nesciunt capto.
LOG0000903,PRESS-001,production,2025-10-11T08:43:01.283Z,OP2,Vae architecto alveus caelestis bonus terra mollitia fugit animus auctus.
LOG0000904,WELDER-001,shutdown,2026-02-02T20:01:26.456Z,OP28,Beatus comminor cruciamentum venustas volup ver speculum quia porro.
LOG0000905,WELDER-001,production,2026-01-24T10:11:21.706Z,OP20,Cubitum cultura claustrum adulatio assentator apto hic.
LOG0000906,WELDER-001,alarm,2025-12-24T06:21:35.170Z,OP7,Creator suppellex conforto corroboro atque vel crustulum.
LOG0000907,WELDER-001,shutdown,2025-11-03T14:08:08.127Z,OP19,Cursus arceo decimus.
LOG0000908,CNC-002,production,2025-12-30T04:05:42.247Z,OP7,Odio cupiditate desidero contego mollitia terga tutamen.
LOG0000909,WELDER-001,alarm,2026-01-22T03:25:34.666Z,OP24,Tyrannus apparatus tribuo terga iure crustulum theatrum.
LOG0000910,FURNACE-001,maintenance,2025-12-19T14:37:24.297Z,OP30,A adfectus tripudio complectus thymbra solus caput color.
LOG0000911,PRESS-001,startup,2025-12-16T00:57:53.207Z,OP16,Terreo atrox taceo adipiscor maxime verto decet terminatio vivo reprehenderit.
LOG0000912,PRESS-002,production,2025-12-28T07:58:57.295Z,OP9,Pauci eveniet decens sumo.
LOG0000913,PRESS-001,alarm,2025-12-18T12:27:13.399Z,OP18,Cado suasoria dolores pax thesis.
LOG0000914,FURNACE-001,alarm,2025-12-14T12:53:12.439Z,OP3,Taceo compello clam thorax.
LOG0000915,WELDER-001,shutdown,2025-10-04T02:43:53.602Z,OP8,Allatus vox hic canonicus veritatis aliquid facilis aer denuncio coma.
LOG0000916,FURNACE-001,shutdown,2025-11-22T12:19:55.686Z,OP4,Thymbra desino balbus ara templum claustrum versus tempus.
LOG0000917,WELDER-001,shutdown,2025-12-28T01:48:20.475Z,OP23,Tantillus ad complectus.
LOG0000918,PRESS-001,shutdown,2025-11-18T00:21:49.863Z,OP23,Voluptatibus denuncio vigor sollicito.
LOG0000919,CNC-002,maintenance,2025-11-24T10:42:32.841Z,OP25,Concido neque allatus.
LOG0000920,PRESS-001,startup,2026-01-10T09:07:55.158Z,OP5,Arguo blanditiis ago aveho confero.
LOG0000921,CNC-001,maintenance,2026-01-04T17:34:32.421Z,OP17,Tertius bonus attonbitus suus deprimo corrigo saepe totidem.
LOG0000922,PRESS-001,alarm,2025-11-25T07:38:07.474Z,OP4,Concedo carus hic arto taceo collum talio animus vapulus tandem.
LOG0000923,CNC-001,alarm,2026-02-06T18:51:43.684Z,OP28,Ventosus cuius aranea amissio ulciscor.
LOG0000924,PRESS-002,startup,2026-01-03T19:56:28.785Z,OP28,Creta occaecati decipio vaco curatio tibi.
LOG0000925,WELDER-001,alarm,2026-01-05T02:40:23.792Z,OP29,Tredecim alo crinis causa nesciunt adflicto soleo.
LOG0000926,WELDER-001,maintenance,2025-11-26T04:45:36.381Z,OP12,Aranea coerceo astrum deludo corona artificiose commodo adamo vomito depereo.
LOG0000927,PRESS-001,shutdown,2026-02-08T04:49:10.591Z,OP15,Quas complectus comitatus aliquam succurro arbor aperte aliquam.
LOG0000928,CNC-002,production,2026-01-31T08:17:00.175Z,OP3,Sumptus ex tabgo delinquo caute vorago attero pecco sollicito.
LOG0000929,PRESS-001,startup,2025-12-14T02:14:54.781Z,OP1,Caelum adipiscor creator.
LOG0000930,CNC-002,shutdown,2026-02-04T10:49:52.259Z,OP2,Rem pax coaegresco fuga avarus.
LOG0000931,PRESS-002,startup,2026-02-08T13:42:22.660Z,OP17,Communis paulatim vinculum defetiscor annus.
LOG0000932,CNC-002,alarm,2025-10-06T22:45:53.462Z,OP7,Sapiente absque ascit cetera aranea annus tondeo accommodo officia.
LOG0000933,FURNACE-001,shutdown,2025-12-23T19:59:04.155Z,OP7,Sperno atavus cedo laboriosam.
LOG0000934,CNC-002,maintenance,2026-01-03T15:55:12.759Z,OP27,Terebro condico alioqui confero utrum maiores.
LOG0000935,CNC-001,production,2025-10-05T10:58:44.087Z,OP14,Suscipio qui adinventitias virgo viridis non blanditiis cui torqueo decumbo.
LOG0000936,WELDER-001,shutdown,2025-10-10T22:46:19.881Z,OP6,Aer valde turpis corroboro cogo.
LOG0000937,WELDER-001,startup,2025-10-31T06:05:37.235Z,OP9,Anser velut quos itaque concedo quibusdam suspendo turbo tabula.
LOG0000938,WELDER-001,production,2025-10-12T20:10:05.019Z,OP24,Alius tactus carcer velit tantillus.
LOG0000939,CNC-001,shutdown,2025-10-17T01:22:23.981Z,OP7,Thalassinus supra utpote reiciendis coniuratio virga animadverto.
LOG0000940,FURNACE-001,alarm,2025-10-16T13:36:01.337Z,OP18,Pecco patria caecus praesentium autus.
LOG0000941,PRESS-001,maintenance,2025-11-22T21:48:32.856Z,OP5,Desidero terminatio custodia.
LOG0000942,PRESS-001,shutdown,2025-10-27T17:23:08.409Z,OP7,Aro comparo damnatio contra tempore.
LOG0000943,FURNACE-001,startup,2025-10-12T16:36:18.574Z,OP29,Stipes nisi decipio cubo trado.
LOG0000944,CNC-001,production,2025-12-25T05:43:18.503Z,OP3,Copiose voluptates carmen tardus contigo conventus.
